DATETIME_OCCURRED,INC_ID,VEHICLE_ID,ROUTE,DELAY_MINUTES,SYMP_SYMPTOM,DESCRIPTION
6/29/2018 5:05:00 PM,2468682,LRV269,101,33,3100,OP ADVISED FRICTION BRAKE C-TRUCKý KEY OUT/UP DIDN`T CLEARý ADVISED TO CUT C TRUCK CONFIRMED IN A CAB. OP ADVISED AND CONFIRMED CUT OUT 7 TIMES. ADVISED ON LOCATION OF C TRUCK ROTA
6/29/2018 6:53:00 PM,2468614,LRV263,101,3,3122,LRV263 ADA RAMP BY DOOR 4ý LATCH WOULD NOT RELEASE RAMP FROM WALL EASILY. OP LEFT RAMP DOWN UNTIL PULL IN.   CAB B
6/29/2018 4:08:00 PM,2468525,1534,P,19,0505,WOULDN?T START// TRADED CALLED CCS WILL PROB BE LATE
6/29/2018 1:36:00 PM,2468424,6154,51,29,0022,STOP ENGINE LIGHT; -29 MIN
6/29/2018 12:10:00 PM,2468389,6063,45,10,1030,BUS WILL NOT GO/NO LEAKS/ASKED HIM TO TURN BUS OFF FOR 30 SEC AND RESTART/IT STARTED TO MOVE AGAIN///1220 BUS BROKE DOWN AGAIN/THIS TIME HE SAID THE RAMP LIGHT IS ON/I ASKED HIM TO
6/29/2018 9:56:00 AM,2468359,5245,31,32,0022,FIRE LIGHT; DROPPED 1.5 TRIPS; -55 MIN
6/29/2018 9:52:00 AM,2468347,5113,31,35,0022,STOP ENGINE LIGHT; BUS SHUT DOWN; DROPPED 1+ TRIPS; -45 MIN
6/29/2018 7:13:00 AM,2468333,6316,0,14,0225,PARKING BRAKE /PLASTIC KNOB/OFF/S14 MEET/ ATTACH TEMP/ T391 944
6/29/2018 5:42:00 AM,2468309,6336,0,11,0022,LOW COOLANT /DUS 726-746//T391/TOP OFF OK
6/29/2018 8:41:00 AM,2468304,6161,12,11,0160,CURBSIDE REAR TIRE IS FLAT/ SIDETRACKED/ CALLED FTCC/ TRIP ENDED AT WASG 64TH 847/ RESPACED 106TH MEL 934AM
6/29/2018 7:03:00 AM,2468253,9319,15L,5,0405,COOLANT LEAK/
6/29/2018 7:33:00 AM,2468243,LRV203,101,3,3138,TCU FAULTSý LRV203. AT RESTRICTEDý CUT CAR AT MINERAL. LRX.47 TO BRING CAR BACK TO ELATI.   CAB A
6/29/2018 6:20:00 AM,2468227,6176,62,31,0405,COOLANT LEAK; DROPPED 1.5 TRIPS; -37 MIN
6/29/2018 6:32:00 AM,2468221,6340,0,30,0001,OP FOUND NOTE BY ANOTHER DRIVER SAYING THAT BED BUGS WERE FOUND ON BUSý DOES NOT WANT TO GET BACK IN THE DRIVERS SEATý SENT BUS 6249 TO TRADE
6/29/2018 6:43:00 AM,2468212,LRV131,101,9,3122,TR. 67 LRV 131 DR. 11 OP. RPT ADA RAMP WAS BROKEN AND WAS UNABLE TO USE. OP. BURIED LRV CAUSING A DELAY OF PULLOUT.   CAB A
6/29/2018 6:36:00 AM,2468206,LRV128,101,8,3138,TR. 15 LRV 128 OP. RPT TCU AND MCB FAULTS ENTERING LITTLETON ST. OP. WAS UNABLE TO CLEAR FAULTS AND TRAIN WAS DE-BOARDED AT OXFORD ST.   CAB A
6/28/2018 7:13:00 PM,2467973,5056,10,27,0505,NO START; -27 MIN
6/28/2018 9:05:00 PM,2467963,LRV289,101,5,3132,PROPULSION FAULT WOULDN?T CLEAR WITH KEY DOWN KEY UP. CUT AT 10TH AND RETURNED TO ELATI.   CAB A
6/28/2018 4:45:00 PM,2467948,6190,76,30,0505,COOLANT LIGHT; CHECK ENGINE; -30 MIN
6/28/2018 5:34:00 PM,2467931,6318,0,70,0022,WHEN BUS LEAVES STOP BUS WILL ACCELERATE THEN BUS LOSES POWER AND SLOWS DOWN / ALSO MIL LIGHT IS ON / TRUCK WIL MEET OP DUS / OP WILL WRITE UP IN DOT BOOK / DVR
6/28/2018 6:18:00 PM,2467912,6266,133,2,0022,STOP ENGINE LIGHT ON.
6/28/2018 4:05:00 PM,2467838,6332,15,10,0012,OP SEAT AIR LEAK // WONT STAY IN PLACE //
6/28/2018 2:31:00 PM,2467832,6080,130,92,0022, ST FIRE SUPPRESSION ALARM ON. OPERATOR RE-SPACED TO AURORA STATION 5:21 PM
6/28/2018 4:29:00 PM,2467814,LRV204,101,15,3100,LRV204 FRICTN BRAKE FAULTS. BELIEVE IT IS B-TRUCK. KEPT STOPPING TRAIN. KEY OUT/IN AND CLEARED BUT FAULT KEPT COMING BACK. OOS AT ALAMEDA SB AND INTO ELATI. FILL SPACE NB AT BROADW
6/28/2018 1:18:00 PM,2467811,2221,16L,191,0610,THE ENGINE STALLED OUTý AND WONT RESTART.
6/28/2018 4:12:00 PM,2467808,LRV217,101,6,3128,APS FAULT. DE-BOARD AT ENGLý PULL INTO ELATI. CUT CONSIST AND PULLED OUT NB TO EVANS. LRV-217   CAB A
6/28/2018 2:49:00 PM,2467769,6330,0,67,0047,HOT LUNCH / FRONT DOOR / SIDE TRACKED / 228PM TRIP CANCELLED / MLX/9 / BUS 9335 / RESPACED TO BDWY & EVANS 3:39PM
6/28/2018 1:41:00 PM,2467762,1679,MALL,47,0230,OP TO TAKE BUS BACK TO DIV AND GET NEW BUS / OP WRITE UP BUS IN DOT BOOK / OP SAID MAINT WIRED TIED INTERLOCK SWITCH / BUS HAD LOW CHARGE WAS AT 44% WAS AT ONLY FIRST TRIP / OP GOT
6/28/2018 12:22:00 PM,2467698,6063,121,58,0610,BUS WONT MOVE? NOISY. BZR. ENG DIED. S/T RESP-113PM S43
6/28/2018 11:22:00 AM,2467668,5131,27,14,0135,THE STEERING IS HARD.
6/28/2018 9:08:00 AM,2467637,9344,120X,20,0610,CK ENG. LOW COOLANT. ADV. ST 120TH/MELODY. T291. ENG DIED. SMALL COOLANT LEAK.
6/28/2018 8:51:00 AM,2467633,9384,83,43,0920,GETTING A STRANGE SMELL INSIDE THE BUS. ADV. T391 DEFROST FAN MAKING THE ODOR. . RESP 1025AM. TRD LATE TO 9317 @ NINE MILE 1217PM
6/28/2018 8:44:00 AM,2467616,5040,205,22,0405,COOLANT LEAK; -22 MIN
6/28/2018 6:59:00 AM,2467540,9364,122X,10,0022,CK ENG; T391
6/28/2018 5:49:00 AM,2467528,2221,80L,27,0038,LOOSE CURB SIDE MIRROR. S/T. T391 RNSP LATE
6/28/2018 6:23:00 AM,2467514,5122,27,20,0038,BROKEN MIRROR; PULL OUT DELAY; -20 MIN
6/28/2018 2:29:00 AM,2467341,6087,169,27,0022,CHECK ENGINEý AND STOP ENGINEý AND LOW COOLANT LIGHT ON AND BUS IS STOPPED. EAST METRO MECHANICS WILL TRADE BUS. BUS RAN TRIP LATE
6/27/2018 10:19:00 PM,2467327,2087,3,3,0505,NO START // LAST TRIP // CURTAILED TRIP // CALLED T TRUCK 317//WILL PULL IN OK NOW
6/27/2018 8:56:00 PM,2467295,LRV292,101,8,3134,LRV 292 HAS A BLOWER FAULT WOULD NOT CLEAR HAD TO TRADE TRAINS AT BROADWAY.   CAB B
6/27/2018 6:47:00 PM,2467289,6183,72,44,0030,REAR DOOR WOULD NOT CLOSE; -44 MIN
6/27/2018 7:38:00 PM,2467279,6023,43,15,0610,BUS STALLED A COUPLE OF TIMES / OP ST CNTR PARK / T-391 / MLX 11 WILL MEET OP CNTR PARK
6/27/2018 2:27:00 PM,2467249,2152,43,171,0022,STOP ENGINE LIGHT / BUS SIDETRACKED AT CENTRAL PARK 240PM/ T391/ MLX 7 BUS 6023 PICKED UP 521PM
6/27/2018 5:45:00 PM,2467231,5061,12,10,0022,OP FIRE ALARM WENT OFF AND BUS SHUT DOWN / CALLED FT / FT SENDING TRUCK / BUS 5046 DOING SPACE AT 549 AT DOWNING PARK
6/27/2018 4:23:00 PM,2467174,LRV210,101,10,3100,LRV210 C-TRUCK. FRICTN BRK FAULT. BRAKES LOCKED. KEY OUT/IN DID NOT CLEAR. CUT OUT VIA ROTARY. CUT LRV AT DUS.   CAB A
6/27/2018 2:46:00 PM,2467166,6309,21,140,0022,DEF FLUID LOW ALARM CAME ON / NO T-TRUCK AVAILABLE AT EM / EM WAS TO SEND PARTS TRUCK WITH DEF FLUID / NO ATTACHMENT AVAILABLR TI FILL UP/ ADVISED OP TO HEAD OVER TO EM TO REFILL D
6/27/2018 2:09:00 PM,2467147,5004,31,59,0160,FLAT TIRE; -82 MIN
6/27/2018 3:38:00 PM,2467140,5246,38,19,0022,LOW HYDRAULIC FLUID LIGHT; -19 MIN
6/27/2018 1:32:00 PM,2467139,6309,21,109,0022,STILL NEEDS DIESEL EXHAUST FLUID. TRUCK SENT BUS TO DIVISIONý REPAIRED AND RE-SPACED TO EVANS STATION 427 PM E/BOUND ON TIME.
6/27/2018 3:19:00 PM,2467130,LRV301,101,3,3123,HVAC FAULTý NO VODý REPORTS OF BEING SLUGGISH. EARLY CUT AT LINC.   CAB A
6/27/2018 3:14:00 PM,2467126,LRV246,101,6,3100,246-Bý FRICTION BRK FAULT WITH LOCK UP. KEY DWN / UP. TWO MORE TIMES. CUT AT LINC   CAB B
6/27/2018 12:55:00 PM,2467120,6048,0,93,0022,COOLANT LIGHT ý STOP ENGINEý ; OPERATOR SHUT DOWNý RESTART FOR COOLDOWNý; TRADEDý RE-SPACED TO BROADWAY / MINERAL N/B LATE.
6/27/2018 12:06:00 PM,2467071,5129,100,88,0012,SEAT WOULD NOT RAISE; DROPPED 1.5 TRIPS; -123 MIN
6/27/2018 12:06:00 PM,2467030,6286,48,56,0030,REAR DOOR PROBLEM. OP DEADHEAD TO PL RR TO CHECK RUBBER SEAL. EB TRIP LOST RE-SPACED TP 72ND-COLORADO. LOST 0:56
6/27/2018 11:17:00 AM,2467028,1401,48,58,0505,NO START / T-391 / OP WILL WRITE UP IN DOT BOOK / OP WILL DEADHEAD TO RLF PNT
6/27/2018 11:01:00 AM,2467004,5196,209,18,0022,LOW ENGINE OIL LIGHT; DROPPED 1 TRIP; -16 MIN
6/27/2018 10:33:00 AM,2466994,3950,324,35,0012,SEAT WOULD NOT LOWER; -28 MIN
6/27/2018 6:55:00 AM,2466955,3907,324,56,0505,NO START; -56 MIN
6/27/2018 6:27:00 AM,2466913,6124,6,10,0610,ALARM CHECK ENGN MIL/RUN LATE
6/27/2018 5:28:00 AM,2466877,5034,31,17,0022,LOW FLUID WARNING LIGHT AND LEAK; -17 MIN
6/27/2018 4:30:00 AM,2466871,6024,16,31,0405,BUS HAS A COOLANT LEAK AND IS SIDE TRACKED. PLATTE MECHANIC WILL RESPOND. BUS WAS TRADED AND RE-SPACED TO DECATUER FEDERAL AT 5:23
6/27/2018 3:31:00 AM,2466689,6075,105,42,0405,THERE IS A STOP ENGINE LIGHT AND LOW COOLANT WARNING LIGHT ON. THERE APPEARS TO BE COOLANT LEAKING FROM THE BACK END OF THE BUS AS WELL. BUS IS CURRENTLY SIDE TRACKED AT SOUTH MOOR
6/26/2018 4:05:00 PM,2466654,3922,27,60,0610,BUS DIED -60 MINS
6/26/2018 6:58:00 PM,2466651,6283,15,96,0022,STOP ENG LIGHT / EM RR TRADED
6/26/2018 6:33:00 PM,2466620,1402,14,15,0022,LOW FUEL LIGHT CAME ON AND WENT OFF AGAIN / BUS STOPPED RUNNING / T-391
6/26/2018 5:10:00 PM,2466591,3659,FF7,26,0160,THE STREET SIDE REAR OUTSIDE TIRE IS FLAT.
6/26/2018 5:49:00 PM,2466589,6130,31,55,0022,CHECK ENGINE -55 MINS
6/26/2018 6:10:00 PM,2466585,LRV285,101,13,3100,LRV 285 THE REPLACEMENT TRAIN FROM 4`S LAST BREAKDOWN. FRICTION BRAKE CENTER TRUCK WITH BCUý WOULD NOT CLEAR CUT C TRUCKý REPLACE CONSIST AT I-25.   CAB A
6/26/2018 6:15:00 PM,2466577,LRV208,101,10,3100,LRV-208 FRICTION BRK FAULTý C-TRK LOCKED UP. CUT OUT TO GET IN STATION. CLEARED AND CAME BACK. CUT LRV OFF BDW.   CAB A
6/26/2018 2:25:00 PM,2466563,5008,402,60,0022,STOP ENGINE -60 MINS
6/26/2018 4:37:00 PM,2466545,6193,12,15,0610,STOP ENGINE -15 MINS
6/26/2018 3:05:00 PM,2466534,6162,28,48,0610,ENGINE DIED OUT -48 MINS
6/26/2018 4:56:00 PM,2466531,1991,J,15,0605,OP SAID BUS HAS LOW POWER / OP SAID HE WILL LIMP BUS BACK TO DIV / OP WILL WRITE UP IN DOT BOOK
6/26/2018 10:47:00 AM,2466528,6318,43,294,0610,THE ENGINE IS LOOSING POWERý AND THE ENGINE DIES OUT PERIODICALLY. T391. RE-SPACED TO WB MLK BLVD/COLORADO BLVD LEAVE TIME 15:41. TIME MISSED FROM 10:47A - 3:41P
6/26/2018 8:19:00 AM,2466376,6328,0,17,0610,ST MLX 10 TRD WAIT FOR TRK RESP DUS 944/GOOD BUS 1109
6/26/2018 6:46:00 AM,2466262,3642,FF,43,0625,OP REPORTED / OIL LEAK AND SMOKE / SIDE TRACKED / T-391 DISPATCHED / CALLED FOLLOWER TO PICK UP PAXS / OP TO FILL DOT BOOK / TRIP CURTAILED
6/26/2018 5:31:00 AM,2466178,1662,MALL,48,0028,OPERATOR DOOR IS NOT OPENING PROPERLY. OPERATOR WAS SENT BACK TO THE GARAGE FOR A TRADE.
6/26/2018 5:26:00 AM,2466169,3740,EV,63,0022,MIL/INFO LIGHT ON; AND ONLY GOES TO 4TH GEAR. ADV TO SHUT ENG OFF; NOW THE TRANSMISSION IS CLEARý BUT OPER KEEPS SAYING ITS TOO UNSAFE AND REFUSES TO DRIVE THE BUS.. T391 SAID THE
6/26/2018 6:03:00 AM,2466163,9317,15L,12,0030,OP PULL OUT DIV LATE HAD REAR DOOR ISSUES WOULDN?T SHUT / RUN LATE /CONT RTE / BUS IS GOOD
6/25/2018 5:57:00 PM,2465913,5236,52,51,0022,LOW VOLTAGE LIGHT; BUS DIED; -51 MIN
6/25/2018 5:16:00 PM,2465885,1501,LX,23,0022,STOP ENG AND CK ENG BUS STALLED OUT /PAX PICKED UP BY 3705 CALLED BOULDER T TRUCK TO CK OUT // NO RESPONSE // TOLD OP TO TRY AND GET BUS BACK TO DIV
6/25/2018 5:58:00 PM,2465883,5017,59,81,0505,NO START; BUS BROKE DOWN; -81 MIN
6/25/2018 3:12:00 PM,2465806,6046,0,13,0030,REAR DOOR STUCK SHUT AND CALLED MLX 78 TO TRADE
6/25/2018 3:58:00 PM,2465802,LRV281,101,15,3100,FRICTION BRAKE FAULT LRV 281 C TRUCK FAULTYý C/O TO ALLOW MOVEMENT OF TRAIN. TRADED OUT CONSIST.   CAB A
6/25/2018 2:23:00 PM,2465757,5008,4,66,0022,CHECK ENGINE; NO LOOP AVAIL; MISSED 2 TRIPS; -66 MIN
6/25/2018 1:47:00 PM,2465752,1402,43,20,0022,NO CHARGE CHECK ENGINE LIGHT - HAD OP CHECK FOR MISSING BELTS - -BUS SIDE TRACKED @ 18TH AND STOUT T391 WILL MEET / 2070 WILL TRADE OUT - WILL LIMP BACK TO PLATTE @1444
6/25/2018 1:23:00 PM,2465749,6280,15,45,0305,THE AIR PRESSURE IS DROPPINGý AND WONT BUILD BACK UP. T316: WILL HAVE TO GO BACK TO THE GARAGE FOR A TRADE. OPERATOR PICKED UP THE SPACE FROM COLFAX AND QUEBEC EB 3:07 PM
6/25/2018 10:33:00 AM,2465730,3731,RX,25,0160,THE CURB SIDE TAG TIRE IS FLAT. MLX ON SPACE FROM CCS LEAVE TIME 12:10.
6/25/2018 11:44:00 AM,2465705,9312,83,47,0610,THE ENGINE KEEPS DYING OUT. RE-SPACED TO CCS LEAVE TIME 13:03. TIME MISSED FROM 11:54 - 12:41.
6/25/2018 8:05:00 AM,2465665,LRV313,101,5,3114,OPER HAD TO LOCK OUT DOOR 4ý LRV313. WOULD NOT CLOSE PROPERLY.   CAB A
6/25/2018 7:08:00 AM,2465658,3657,FF7,4,0150,TAG AXLE WAS MISSING A GREASE COVER.
6/24/2018 6:51:00 AM,2465320,5245,51,7,0022,STOP ENGINEý COOLANTý AND FIRE LIGHT/ BUS IS SIDETRACKED/ CALLED FTCC/ RAN ROUTE 7 MINS LATE
6/24/2018 6:08:00 AM,2465319,6124,48,54,0022,LOW COOLANT MIL STOP ENGINE / SIDE TRACKED @72ND AND COLORADO / TRUCK IN ROUTE / TRADE IN ROUTE / TREADED AND DEAD HEADED TO 113 AND WELTON TO START NB TRIP / TRUCK FOLOWED BACK TO
6/25/2018 10:06:00 AM,2465270,5188,19,20,0022,STOP ENGINEL LOW COOLANT; -20 MIN
6/24/2018 12:02:00 AM,2465054,LRV294,101,3,3106,ATS RECEIVED AT ALAMEDA INBOUND HIGHBLOCK WHILE TRAIN WAS SITTING AT A FAVORABLE SIGNAL   CAB A
6/23/2018 5:43:00 PM,2465050,3925,100,122,0505,NO START -122 MINS
6/23/2018 3:20:00 PM,2464928,1501,AB,55,0022,BUS STALLED ON HWY / CHK ENG STOP ENG LIGHTS CK FOR LEAKS / CALLED PLATTE FOR BUS AND TRK TO GO TO SCENE //ASAP // CURTAILED FIRST TRIP AND CANCELLED TRIP AT 408P// CALLED SS43 TO
6/23/2018 12:59:00 PM,2464818,5148,145X,20,0022,OIL LEAK -20 MINS
6/23/2018 12:42:00 PM,2464806,3645,FF,56,0047,HOT LUNCH IN REAR OF BUS/TO PLATTE FOR TRADE/RLF OP MADE RLF AND WAS DH TO BOULDER FOR EB TRIP/TRIP CANCELLED WB
6/23/2018 12:35:00 PM,2464800,6110,15,15,0022,CK ENG/OP SAYS HE DOESN?T FEEL ITS SAFE TO CONTINUE/HE SAID NO LEAKS BUT BUS JERKS ETC/ST/PAX BOARDED OTHER BUSES/ST/LX T/T391-MUST BE SENT TO GARAGE//LX TAKING BUS TO PLATTE
6/22/2018 11:13:00 PM,2464508,LRV262,101,3,3136,DEADMAN INOP USED HAND DEADMAN   CAB B
6/22/2018 10:06:00 PM,2464503,5055,112,17,0505,NO START; DROPPED 1 TRIP; -17 MIN
6/22/2018 7:46:00 PM,2464490,3650,FF,69,0620,BELT BROKE CALLED BOULDER MAINTENANCE TO CK OUT//REPAIRED ENOUGH TO MAKE IT TO PLATTE BUT NEEDS TRADE //CURTAILED TRIP AND CANCELLED NEXT ONE // GOT TRADE ARRANGED WITH RR AND WILL
6/22/2018 5:00:00 PM,2464398,9317,15L,27,0022, HISP MALE DK SLEEPER ON BACK OF BUS GRAY PANTS WHITE BB CAP //CALLED SS30 AND SCC1 TO INTERVENE // BUS STALLED ALL PAX EXITED// STOP ENG LIGHT CK ENG LIGHT LEAKING // CALLED EM SE
6/22/2018 3:33:00 PM,2464391,6322,16,15,0047,CURTAILED TRIP //CALLED MLX 20 TO TRADE AND CALLED FOLLOWER 2070 TO ACCOMMODATE PAX
6/22/2018 1:16:00 PM,2464251,5208,BOND,10,0160,RIGHT OUTSIDE DUAL BLEW OUT; FTLMA ADVISED; LX (5229) ON ROUTE AT BJDS 152 PM
6/22/2018 10:11:00 AM,2464222,6008,43,48,0405,COOLANT LEAK/ST T391/GOOD TO GO 1111/RESP 11 LARIMERE/1141/
6/22/2018 10:25:00 AM,2464197,5109,30,45,0505,NO START; DROPPED 1 TRIP; -45 MIN
6/22/2018 7:07:00 AM,2464112,1991,FF,32,0022,CHECK TRANS LIGHTý UNABLE TO GO 45MPH/ BOULDER T288 WILL MEET AT TABLE MESA / NO NLX/ CANCELLED TRIP/ RESPACED CCS 843AM
6/22/2018 7:19:00 AM,2464111,5183,92,23,0505,NO START; -23 MIN
6/22/2018 6:02:00 AM,2464093,6016,48,57,0022,CHECK ENGINE STOP ENGINE / LOW COOLANT LIGHT SIDE TRACKED @ 72 AND COLO / T-391 IN ROUTE TO FILL / FAULTY COOLANT SENSORS DISCONNECTED TO TRADE OUT @ PLATTE / DEAD HEAD TO PLATTE T
6/22/2018 7:00:00 AM,2464087,6159,52,77,0022,FIRE ALARM; DROPPED 1 TRIP; -77 MIN
6/22/2018 5:11:00 AM,2464049,5008,51,34,0405,COOLANT LEAK; -34 MIN
6/21/2018 3:36:00 PM,2463817,5197,228,41,0405,COOLANT LEAK -41 MINS
6/21/2018 3:16:00 PM,2463815,5131,483,61,0625,OIL LEAK -61 MINS
6/21/2018 8:41:00 PM,2463783,6266,153,15,0012,OPERATOR CLEARED
6/21/2018 4:07:00 PM,2463763,2299,FF,38,0022,STOP ENG LIGHT BUS ST/ BLDR RR/ MLX 6 ON SPACE AT 458PM
6/21/2018 3:29:00 PM,2463762,6030,16L,23,0405,LOW COOLANT STOP ENG BUS ST/ MLX 5 5142 ON APSCE AT 411PM/ T391
6/21/2018 5:14:00 PM,2463742,6041,131,15,0022,LOW OIL/ MLX 15 TRADED/ T287
6/21/2018 3:04:00 PM,2463734,5029,52,9,0305,THE AIR PRESSURE KEEPS GOING ALL THE WAY UP TO 150. HEADING BACK TO HAVE A MECHANIC LOOK AT IT.
6/21/2018 5:48:00 PM,2463701,LRV285,101,6,3100,LRV285 C-TRUCK. FRICTN BRAKE FAULT. STOPPED TRAIN. KEY OUT/IN TO CLEAR. KEPT RECURRING. KEY OUT/IN CLEARED EACH TIME. CUT OFF AT OSAGE SB AND PULLED LRV INTO MARIPOSA. CONTINUED RE
6/21/2018 4:59:00 PM,2463684,6036,0,60,0022,CHK ENG LIGHT / STOP ENG LIGHT / PAXS TRFR TO FOLLOWER / SIDE TRACKED / AT I-25 / MLX20 / BUS 6335 TO TRADE / CALLED DUS / OP RESPACED TO BRDWY & COLFAX SB TRIP @6:15PM
6/21/2018 3:22:00 PM,2463604,6315,12,27,0610,THE ENGINE STALLED OUT. THE FOLLOWER WILL PICK UP THE PASSENGERS. T391. MLX BLOCK 78 ON SPACE FROM WAGON RD PNR. RE-SPACED TO WAGON RD PNR.
6/21/2018 9:59:00 AM,2463463,6318,16,57,0405,COOLANT LEAK/SLIGHT/BUS ATTEMPTED TO DIE ON THE WAY OUT HERE/ST/T317/NO LX AVAILABLE/RESP CFX BDWY
6/21/2018 9:04:00 AM,2463452,9369,83,22,0610,OP HAD ALARM GO OFF AND THEN BUS SHUT DOWN / CALLED EM MAINT / EM WILL SEND T-TRUCK
6/21/2018 7:06:00 AM,2463425,1521,CV,70,0605,OP FRONT DOOR AIR LIGHT ON BUS ONLY GOES 8MPH / T-TRUCK 391 ON WAY / OP FLUID LEAKING / BUS HEADED BACK TO DIV
6/21/2018 5:16:00 AM,2463332,LRV226,101,5,3100,226 C-TRUCK CUT OUT DUE TO BRAKE FAULT AND BLUE LIGHT ON. HAPPENED WHEN TRAIN WAS BRAKING INTO STATIONS AND CLEARED FOR ABOUT FIVE KEY DOWNS/ UP BUT EVENTUALLY HAD TO BE CUT OUT.
6/20/2018 9:30:00 PM,2463123,3603,FF,10,0028,THE FRONT DOOR OPEN LIGHT IS ON AND THE BUS WILL ONLY GO 5 MPH .BUS IS EMPTY AND OPERATOR WILL TRY TO GET THE BUS BACK TO THE DIVISION.
6/20/2018 9:41:00 PM,2463111,LRV297,101,20,3138,BCU AND TCU FAULTS ON LRV 297 HAD TO CUT OUT ALL THE BRAKES IN THE CONSIST   CAB A
6/20/2018 5:47:00 PM,2463055,6092,15,10,0022,REGEN LIGHT ON CK ENG AND ALARM/ CALLED EM TO ARRANGE TRADE OUT FRONT //
6/20/2018 5:43:00 PM,2463052,6065,42,20,0022,STOP ENGINE /CHK ENG CHKING FOR LEAKS // CALLED T TRUCK TO CK OUT //FOLLOWER 6098 TO PICK UP PAX /LAST TRIP CURTAILED
6/20/2018 4:07:00 PM,2463025,3941,323,41,0022,STOP ENGINE AND LOW COOLANT LIGHTS; BUS DIED; -41 MIN
6/20/2018 4:11:00 PM,2463009,3918,27,47,0705,BUS WOULD NOT GO INTO GEAR; -47 MIN
6/20/2018 4:01:00 PM,2463004,LRV310,101,11,3100,FRICTION BRAKE C TRUCKý KEY OUT UP DIDN`T CLEAR. AT RESTRICTED TO SOUTHMOORý PARTIAL LOSS BELLVIEW TO ALAMEDAý LRX 50 IN SERVICE NB 10TH AND OSAGE.   CAB A
6/20/2018 3:11:00 PM,2463001,6108,153,77,0160,CURBSIDE OUTER DUAL FLAT // CALLED EM TO SEND OUT T TRUCK TO CHANGE TIRE// CANCELLED TRIP AT 321P// REPAIRED AT 1630 TOLD OP TO DH TO CHAMBERS AND QUINCY NB AND CURTAILED TRIP TO 5
6/20/2018 1:53:00 PM,2462948,6141,100,56,0160,FLAT TIRE; -56 MIN
6/20/2018 2:58:00 PM,2462908,5133,225,42,0022,CHECK AND STOP ENGINE LIGHTS; BUS STALLS; -38 MIN
6/20/2018 12:12:00 PM,2462866,6315,16L,18,0610,STALLS OPP RESETS/CHECK MIL/NO LEAKST391/COLFX WADS /1PM/GOOD BUS RUN LATE
6/20/2018 11:34:00 AM,2462825,9389,15L,81,1005,RAMP NOT WORKING/T391/15TH CHAMPA/ALL PAX OFF BUS ACCMD FOLLOWER/GOT REPAIRED/DH TO AURORA STN 118PM/CNX TRIP
6/20/2018 5:16:00 AM,2462646,1504,LD,63,0022,CK ENG LIGHT; NO POWER
6/19/2018 4:32:00 PM,2462349,5145,3,29,0028,FRONT DOOR -29
6/19/2018 5:07:00 PM,2462342,1518,RX,74,0315,OP REPORTED THAT THE BRAKE PRESSURE IS LOW/ATTEMPTED A RE START/CALLED T391/BUS AIREDý MOVING TO 16TH AND LINCOLN TO CHECK/RUN DROPPED
6/19/2018 4:03:00 PM,2462326,6073,105,10,0022,OP CK ENG LIGHT ý NO VOLT AND NO CHARGE LIGHT ON / TRADED AT CNTR PARK / RESPACED TO COLFAX AND HAVANA START SB TRIP
6/19/2018 3:45:00 PM,2462321,6033,0,23,0022,ALARM SOUND / WILL NOT STOP / T-391 RESET ALARM / CANCELLED TRIP / RESPASED OP TO I-25 & BROADWAY / WILL PICK UP WB TRIP 4:39PM
6/19/2018 12:41:00 PM,2462235,6264,45,76,0405,COOLANT LEAK/ST/EM RR TRK/GOT TO GO RESP CENTRAL PARK 218PM
6/19/2018 1:44:00 PM,2462226,5198,228,6,0505,STOP ENGINE LIGHT ON BUS DIED. NO LEAKS. FTL SENDING LX TO TRADE
6/19/2018 12:53:00 PM,2462202,5071,40,38,0505,NO START -38 MIN
6/19/2018 7:02:00 AM,2462070,1810,FMR,63,0610,STALLED /CHECK ENGNSTOPPED/ST/T391/TO PL FOR TRADE ?1811
6/19/2018 7:07:00 AM,2462051,5056,55L,26,0505,NO START-26 MINS
6/18/2018 10:47:00 PM,2461793,6032,0,52,0405,STOP ENG COOLANT SPEED SW ETC?.LX T/1054 BUS BROKE DOWN AT OXFORD/LX SENT THERE/PAX BOARDED FOLLOWER/RESP DUS/T391
6/18/2018 4:52:00 PM,2461705,5045,10,30,0610,ENGINE DIED; SERVICE TRUCK; -30 MIN
6/18/2018 3:58:00 PM,2461694,6164,52,78,0022,STOP ENGINE LIGHT; NO LOOP AVAIL; -78 MIN
6/18/2018 2:54:00 PM,2461683,6023,9,94,0022,THE CHECK TRANSMISSION LIGHT CAME ON FOLLOWED BY ENGINE SHUT DOWN. T391. RE-SPACED TO THE 17:07 TIME POINT.
6/18/2018 4:09:00 PM,2461682,9306,15L,5,0038,NEED MIRROR TO BE ADJUSTED/ CONTACT RUNNING REPAIR/ WILL HAVE MECH . MEET BUS AT EAST LOOP/ ADVISE OP TO PULL INSIDE LOOP
6/18/2018 3:02:00 PM,2461644,5232,20,96,0012,FLAT TIRE; OP SEAT LOSING AIR; -96 MIN
6/18/2018 10:53:00 AM,2461640,3927,401,69,0110,BUS LEANING; SERVICE TRUCK; -69 MIN
6/18/2018 11:33:00 AM,2461571,5194,205,47,0505,NO START; -47 MIN
6/18/2018 11:19:00 AM,2461548,1510,AB,12,0505,NO START.
6/18/2018 11:05:00 AM,2461525,1536,AT,13,1015,TRYING TO RAISE AN ADA PAX BUT THE LIFT STOPS AFTER 2INCHES. ADV. BARRIOR WAS NOT GOING DOWN ALL THE WAY NOW OK. ADA OK.
6/18/2018 9:57:00 AM,2461497,5139,105,59,0012,DRIVER CANT GET SEAT TO MOVE. MLX 10 TO TRADE/ S-27/ MACIAS/ RESPONDING TO ASSIST/ UPSET PAX ON DELAY /NEW BUS RESPACED TO HAVANA & MISS./ 11:04 AM/ RT CURTAILED /57 AM TO 11:04 AM
6/18/2018 9:00:00 AM,2461485,6092,131,12,0022,CHECK ENGINEý REGENý STOP ENGINE ý HIGH EXHAUST/ BUS SHUT DOWN/ / T-287/ NO MLX / FOLLOWER WILL ACCOMMODATE 2 PASSENGERS ONBOARD IN 30 MINS
6/18/2018 6:29:00 AM,2461472,5131,27,40,0022,STOP ENGINE LIGHT; SERVICE TRUCK; -40 MIN
6/18/2018 7:51:00 AM,2461469,6169,30,39,0022,STOP ENGINE LIGHT; TRADE; -39 MIN
6/18/2018 6:52:00 AM,2461432,1809,FMR,31,0305,NO PSI. RESP 722AM
6/18/2018 5:41:00 AM,2461423,1553,CV,79,0405,COOLANT LEAK. T291 ST.
6/18/2018 5:46:00 AM,2461380,9393,120X,19,0160,CURBSIDE OUTSIDE MIDDLE TIRE FLAT BUS ST. TRIP LOST.05:48--06:07. LOSS 19 MINUTES. MLX 13 TRADE CONTINUE
6/18/2018 5:38:00 AM,2461373,6301,73,2,0040,S35; TRADING THE BUS. DRIVER WIPER FELL OFF.
6/17/2018 3:40:00 PM,2461253,6138,51,60,0160,FLAT TIRE; -60 MIN
6/17/2018 3:04:00 PM,2461166,LRV149,107,6,3138,TCU FAULT LRV149. HAD SOME SLIP/SLIDE DUE TO WET RAIL BUT OP RPTS NO SAND DROPPING. AT RESTR SPEED. KEY OUT/IN DID NOT CLEAR. COASTING FREELY. LEAVE IN SERVICE TO PEORIA AND TRADE
6/17/2018 1:45:00 PM,2461133,LRV319,101,15,3100,LRV319 C-TRUCK- FRICTION BRAKE FAULT. KEY OUT/IN DID NOT CLEAR. CANNOT MOVE. CUT OUT VIA ROTARY. OOS AT STHMR. FILLED SPACE SB AT ALAMEDA STATION.   CAB A
6/17/2018 11:59:00 AM,2461079,5186,20,33,0022,LOW COOLANT; -33 MIN
6/17/2018 10:48:00 AM,2461041,5198,205,21,0022,WARNING LIGHT; -21 MIN
6/17/2018 4:29:00 AM,2460941,6082,153,74,0022,CHECK ENGINE LIGHT STOP ENGINE LOW COOLANT SIDE TRACKED - TRADE OUT WITH LOOP BUS AND WILL RUN FROM AURORA STN @6:29AM
6/16/2018 5:17:00 PM,2460810,LRV268,103,4,3100,LRV-268-C TRUCK CUT OUT. COULD NOT CLEAR FAULT. DYNAMIC FAULT ALSO REPORTED. PRULP FAULT ALSO REPORTED. OP. SAYS TRAIN IS ROLLING FREELY. TRADE @ DUT.   CAB B
6/16/2018 3:50:00 PM,2460772,3922,402L,88,0022,CHECK ENGINE LIGHT; -57 MIN
6/16/2018 2:01:00 PM,2460740,6125,38,10,0047,HOT LUNCH/ WILL TRADE OUT/ NEW BUS TO RUN LATE.
6/16/2018 11:32:00 AM,2460721,3912,27,83,0505,ST NO START ý THE BUS DIED AND WON`T RESTART. TD STARTED AND RESPACED TO FEDERAL EVANS WB 1253PM -83 MINUTES SERVICE DELAY
6/16/2018 11:31:00 AM,2460687,5116,72,40,0505,NO START; TRADE; -40 MIN
6/16/2018 9:54:00 AM,2460649,5186,92,14,0610,BUS SHUT DOWNý NO WARNING LIGHTS/ SIDETRACKED/ CALLED FT OP ERROR/ RAN LATE
6/16/2018 8:28:00 AM,2460614,1403,28,5,0022,CK ENGINE/ HAS NO POWER/ BUS STALLING/ REBOOT COMPUTER/ TURN BUS OFF AND THEN BACK ON/ BUS MOVING/ BUS BACK ON ROUTE./ RUNNING LATE.
6/16/2018 7:45:00 AM,2460612,9378,15L,62,0022,CK ENGINE/ LOW COOLANT/ LEAKING RED FLUID/ STOP LIQUID FROM GOING INTO SEWERS/ RUNNING REPAIR SENDING TRUCK/ TRADE OUT / TRIP CANCELED/ 7:41 AM TO 8:47AM/ NEW BUS RESPACE TO AURORA
6/16/2018 6:43:00 AM,2460590,3938,100,30,0140,FRONT END SHIMMIE; -32 MIN
6/15/2018 9:14:00 PM,2460394,6023,16L,15,0022,BUS STALLED A COUPLE TIMES /TOLD OP IF STALLS OUT IN TRAFFIC TO CALL BACK // WILL TRY TO GET BACK TO GARAGED WITHOUT TRADE OR TRUCK //CALLED T TRUCK 391 //STOPPED BUS AT HARLAN CAL
6/15/2018 5:26:00 PM,2460239,3723,BOLT,55,0630,NEED SERPENTINE BELT/ST/T288/ON LAST TRIP AND IT WAS CANCELLED
6/15/2018 4:28:00 PM,2460223,6202,10,4,0022,OIL LIGHT/ BUZZER/ ADVS. FTC DIV./ OP WILL CK FOR BROKEN BELTS OR HOSES/ CK OK/ ADVISE DIV./ S/T AT 1635 HRS./ BUS WILL BE TRADED OUT AND WILL RUN LATE.
6/15/2018 3:49:00 PM,2460208,6267,15,32,0022,CHK ENG STOP ENG AND STALLED OUT//CALLED T TRUCK 391 TO ADVISE /CURTAILED TRIP TO DUS // CURTAILED TRIP TO CHAMPA /WILL START EB TRIP THERE // 434P//GOOD BUS NOW /
6/15/2018 3:22:00 PM,2460199,LRV123,103,5,3103,TWC NOT WORKINGý CIRCUIT BREAKER WON`T FIXý DOESN`T LIGHT/ROUTE.   CAB A
6/15/2018 12:14:00 PM,2460192,6340,44,10,0160,OP REPORTED THE FRONT CURBSIDE TIRE IS LOW PSI / T-316 WILL MEET MLX TO CHECK TIRE
6/15/2018 3:39:00 PM,2460179,LRV313,101,6,3103,313-B TWC NOT WORKING. MANUAL CALLS FROM SCADA ON PULLOUT TO EARLY CUT AT LINCOLN.   CAB B
6/15/2018 1:43:00 PM,2460144,3937,77,285,0625,OIL LEAK; DROPED 4 TRIPS; -135 MIN
6/15/2018 1:15:00 PM,2460121,3918,483,65,0022,CHECK ENGINE AND LOW COOLANT LIGHTS; BUS SHUT DOWN; DROPPED 1 TRIP; -65 MIN
6/15/2018 12:53:00 PM,2460090,LRV112,103,2,3138,TCU FAULTý LRV112. AT RESTRICTED SPEEDý ROLLING FREELY. CUT CAR AT DUSý RUN AS 2 CAR.   CAB A
6/15/2018 7:08:00 AM,2459976,6096,15,36,0305,PSI DROPPED /ST/MRR TRK/TO EM TRD
6/15/2018 6:11:00 AM,2459875,1528,P,8,0046,TROUBLE LOCKING LIFT DOOR
6/15/2018 5:12:00 AM,2459857,6035,38,15,0610,ENGINE DIED 2 TIMES/DOORS WONT OPERATE / WONT GO INTO GEAR /T391 IN ROUTE/BUS IS OKAY RESET BY TRUCK/ IN ROUTE TO START ROUTE LATE
6/15/2018 12:33:00 AM,2459701,2080,15,23,0022,STOP ENG AND CK ENG AND ALARM //NO LEAKS // CALLED PLATTE RR TO SEND TRK AND CALLED BUS 6255/// CURTAILED TRIP //UNFORTUNATELY PAX WERE //CLEARED BY T391 @ 139 OP WILL TRANPORT PAS
6/14/2018 9:44:00 PM,2459673,LRV210,109,1,3134,BLOWER FAULT PAN DOWNý CLEANED FILTERS. BLOWER FAULT CAME BACK. MECHANICS MET LRV AT 30TH.   CAB B
6/14/2018 7:58:00 PM,2459657,3945,204,20,0505,NO START -20 MINS
6/14/2018 4:49:00 PM,2459596,6010,1,131,0022,CHECK 12 VOLTý CHECK 24 VOLT LIGHT ON. T391. RE-SPACED TO STOUT/16TH. CANCELLED TRIP PICKED UP SPACE AT 736P
