DATETIME_OCCURRED,INC_ID,VEHICLE_ID,ROUTE,DELAY_MINUTES,SYMP_SYMPTOM,DESCRIPTION
2/12/2018 3:11:00 PM,2390470,6301,15,15,0705,ST BUS WONT GO INTO GEAR.ý OPERATOR CLEARED THE PROBLEM AND CONTINUED ON ROUTE 15 MINUTES DOWN.
2/12/2018 9:52:00 AM,2390375,3935,27,41,0160,FLAT TIRE; TRADE; -41 MIN
2/12/2018 5:33:00 AM,2390332,3923,483,94,0022,COOLANT LEAK; SMOKE; STOP ENGINE; NO TRADE AVAILABLE; MISSED ALL 3 TRIPS; PULL OUT DELAY; -94 MIN
2/12/2018 5:55:00 AM,2390263,3938,77,38,0022,LOW OIL/STOP ENGINE LIGHT; -38 MIN
2/12/2018 1:07:00 AM,2390135,6308,15,12,0022,HAD TO PULL-IN IN TO GARAGE ON LAYOVER TO GET DEF FLUID REFILLED. NEXT TRIP STARTED AT 01:18
2/11/2018 3:08:00 PM,2390100,5149,51,39,0610,BUS DIED; SERVICE TRUCK; -39 MIN
2/11/2018 12:48:00 PM,2390036,1539,AA,10,0405,SIDETRACKED ON HWY // CALLED MLX 4 TO TRADE //CALLED EM AND GAVE RR INSTRUCTIONS TO MEET BUS / HAD OP RUN LATE // MLX OP WAITING ON T TRUCK //WILL HAVE TO TOW IN CALLED SS 39 TO TR
2/11/2018 11:04:00 AM,2389991,9375,15L,22,0405,SS43 CALLED COOLANT LEAK // TOLD TO PUT DOWN FLOOR DRY AND CALLED T TRUCK 316 TO ADVISE //IN ROUTE//MLX 2 TO RUN SPACE FROM 1124A TO 1213P // 6315//OP GOT NEW BUS AND WILL DH TO CO
2/10/2018 8:22:00 PM,2389732,6092,83,79,0920,DEFROSTER QUIT WORKING // WILL SEND OUT TRADE FROM EMý OPERATOR RAN THE 9:52 PM TRIP LATE.
2/10/2018 5:07:00 PM,2389724,6336,0,48,0022,T TRUCK 316 TO GIVE MORE FUEL AT DUS // ON WALL/// DON?T KNOW WHOSE MISTAKE IT WAS MINE OR T TRUCK /BUT ANYWAY CANCELLED TRIP AND ARRANGED TO MEET BUS AT 730 DUS // HAD BUS DH TO E
2/10/2018 5:57:00 PM,2389689,5138,JUMP,60,0505,NO START; SERVICE TRUCK; -60 MIN
2/10/2018 5:42:00 PM,2389687,5238,52,23,0135,STEERING TOO TIGHT; -23 MIN
2/10/2018 11:49:00 AM,2389614,1402,48,8,0605,CK ENG AND ALARM AND DEF LIGHT ON LOSING POWER DERATING // CALLED PLATTE FOR TRADE
2/10/2018 9:57:00 AM,2389543,6220,DASH,6,0022,CHECK ENGINE LIGHT
2/10/2018 8:10:00 AM,2389534,5121,20,43,0520,ELECTRICAL PROBLEM; WON`T GO INTO GEAR; TRADE; -43 MIN
2/10/2018 5:50:00 AM,2389530,9317,15L,14,0610,BUS SHUT DOWN WHILE IN MOTION/ NO WARNING LIGHTS/ MLX 7 ON SPACE FROM 17TH CHAM 616AM-932AM /T316/ S41/
2/10/2018 6:01:00 AM,2389493,5121,20,49,0022,NO CHARGE LIGHT; SERVICE TRUCK; -49 MIN
2/10/2018 6:53:00 AM,2389489,5162,92,20,0040,BUS (WIPERS?) NOT WORKING; -20 MIN
2/10/2018 5:32:00 AM,2389467,9374,15L,15,0038,BROKEN MIRROR/ CHANGING BUSES/ INFO UPDATED/ WILL RUN LATE
2/10/2018 5:23:00 AM,2389456,5119,76,12,0920,PULL OUT DELAY; DEFROST NOT WORKING
2/10/2018 4:53:00 AM,2389448,6266,121,12,0705,BUS TRADED OUT AT PULL OUT DUE TO A PROBLEM WITH THE TRANSMISSION. EM NOTIFIED. SEE DVIR. OPERATOR ARRIVED TO THE START TERMINAL 12 MINUTES LATE.
2/9/2018 8:19:00 PM,2389274,LRV300,103,3,3108,TWO MIRRORS ON LRV 300 ARE SHATTERED AND TWO MIRRORS ON LRV 293 ARE SHATTERED.   CAB A
2/9/2018 7:08:00 PM,2389246,LRV104,101,5,3114,DOOR 12 ON LRV 104 HAD TO BE CLOSED OUT THE RUBBER STRIPS DO NOT LINE UP.   CAB A
2/9/2018 5:19:00 PM,2389243,5205,225,59,0405,LOW COOLANT; STOP ENGINE LIGHT; -59 MIN
2/9/2018 3:47:00 PM,2389139,3621,FF,12,0705,NOT GOING INTO GEAR /OPP GOT TO GO OK RUN LATE
2/9/2018 3:13:00 PM,2389111,6125,48,40,0310,HOSE UNDER SEAT DISCONNECTED/ RUNNING REPAIR SENDING MECH./ FIXED/ RESPACE TO 72ND & COLO./ 4:08 PM
2/9/2018 2:04:00 PM,2389076,5075,157,60,0160,FLAT TIRE; DROPPED 2+ TRIPS; -60 MIN
2/9/2018 12:50:00 PM,2389058,9375,15L,90,0405,LARGE COOLANT LEAK. S/T. S41 TO TRANSPORT OPER. RESP-238P
2/9/2018 1:03:00 PM,2389040,5238,30,48,0505,NO CHARGE LIGHT; DROPPED 1.5 TRIPS; -48 MIN
2/9/2018 11:59:00 AM,2389025,6112,42,92,0610,THE ENGINE DIED OUT. RE-SPACED TO ORLEANS/MAXWELL LEAVE TIME 13:39.
2/9/2018 11:50:00 AM,2389010,9367,15L,10,0016,DRIVER SIDE IS LOOSE. OPER WILL PULL INTO EM DRIVEWAY EMRR TO FIX.
2/9/2018 10:11:00 AM,2388961,LRV300,103,1,3117,OP. REPORTS GLASS PARTITION NEAR DOOR 2ý LRV-300 CRACKED. #334 TO MEET AND TAPE UP.   CAB A
2/9/2018 8:04:00 AM,2388913,LRV250,101,3,3138,TCU FAULT STOPPED TRAIN TWICE. CUT OFF SINGLE LRV AT MINERAL TT.   CAB A
2/9/2018 7:57:00 AM,2388904,6286,15,40,0405,LEAKING FLUID FROM THE FRONT OF BUS/ LOOP 2 TO ASSIST/ TO EAST/ NEW BUS RESPACED TO COLFAX AND ONIEDA/ 8:52 AM
2/9/2018 6:26:00 AM,2388895,6192,55L,45,0022,CHECK ENGIN AND DEF LIGHT; DROPPED 2 TRIPS; -80 MIN
2/9/2018 5:41:00 AM,2388874,9388,169L,47,0047,HOT LUNCH;OPER WILL DH TO EM THEN RESP-613AM LATE.
2/9/2018 5:58:00 AM,2388843,6008,16,52,0205,BRAKE PEDEL IS GOING TO THE FLOOR. S/T. RESP-708AM
2/8/2018 9:55:00 PM,2388649,6307,153,74,0022,ST CHECK ENGINE AND DISEL FUEL EXHAUST LIGHT ON.OPERATOR RE SPACED TO PEORIA STN 11:21 PM
2/8/2018 5:37:00 PM,2388570,6255,15,28,0645,BUS LEAKING FUEL AS REPORTED BY BUS 6065 WHICH WAS BEHIND HER/I ASKED OP TO PULL OVER AND WAIT FOR MECHANIC//ON CFX BETWN BDWY AND LINC/T317-REPAIRED/HAD OP RESP AT CFX DOWNING AND
2/8/2018 4:45:00 PM,2388553,3927,46,85,0105,SUSPENSION -85 MINS 1.5 TRIPS
2/8/2018 2:30:00 PM,2388544,1402,121,46,0610,STALLED /ST/EM RR TRK/TO EM TO TRADE 1632 COLO STN RUN
2/8/2018 10:26:00 AM,2388500,6018,9,28,0610,THE ENGINE DIED OUTý AND THE FIRE ALARM IS ON. S37.
2/8/2018 10:01:00 AM,2388498,5015,31,17,0022,NO CHARGE -17 MINS
2/8/2018 1:13:00 PM,2388462,6271,34,10,0004,OPER SAID THE BUS SMELLS TOO BAD TO MOVE IT. ODOR CAME FROM PAXS. S/T. OPER SAID THE BUS IS NOW OK AFTER THE PAXS LEFT THE BUS;
2/8/2018 7:15:00 AM,2388348,9315,15L,41,0047,HOT LUNCH ADV. OPER WILL PULL INTO EM FOR A TRD. RESP-804AM LATE
2/8/2018 6:36:00 AM,2388306,9324,0L,21,0022,CK ENG EXHAUST REGEN. RESP 751A.
2/8/2018 6:28:00 AM,2388295,6200,10,10,0705,ST/CHECK TRANS LIGHT ON AND WON`T GO INTO GEAR/ STUCK IN THE TURN LANEý RESET BY SHUTTING THE BUS DOWN AND RESTARTING/ CLEARED AND CONTINUING TO FT
2/8/2018 6:41:00 AM,2388283,9366,3L,1,0305,S23 SOLANO/ OPERATOR PULLED OUT 7 MIN LATE DUE TO AIRPRESSURE PROBLEM
2/8/2018 5:29:00 AM,2388272,3921,77,85,0022,STOP ENGINE LIGHT HAS COME ON. BUS IS SIDETRACKED. TD NOTIFIED BUS WAS RE-SPACED TO PARK MEADOWS AT 6:52AM
2/8/2018 5:21:00 AM,2388240,6154,27,49,0022,WARNING LIGHT -49 MINS
2/7/2018 10:17:00 PM,2388100,5152,76,22,0610,ENGINE STALLS; -22 MIN
2/7/2018 6:32:00 PM,2388088,6142,51,110,0705,BUS WOULD NOT GO INTO GEAR; DROPPED 1 TRIP; -110 MIN
2/7/2018 7:03:00 PM,2388087,6080,15,37,0022,RED COOLANT TEMP LITE EM RR TRK /ST TRK /TO PL GET NEW BUS /GOT THIS
2/7/2018 6:20:00 PM,2388045,6320,16L,49,0705,PERIODICALLY THE TRANSMISSION WONT SHIFT OUT OF 1ST GEAR.
2/7/2018 4:52:00 PM,2388019,5181,32,48,0505,NO START; -48 MIN
2/7/2018 4:17:00 PM,2387992,1402,16,62,0605,THE BUS IS LOOSING POWER AGAIN. SEE OTHER CALL.
2/7/2018 3:46:00 PM,2387989,6075,20,62,0405,THE TOP OF THE RADIATOR IS CRACKED. THE BUS WILL HAVE TO GO BACK TO THE GARAGE FOR A TRADE. MLX BLOCK 78 ON SPACE FROM DUS. RE-SPACED TO 16TH/AURORA CT.
2/7/2018 1:02:00 PM,2387975,5262,135,30,0210,WHEN OP APPLIES THE BRAKES THE BUS PULLS TO THE LEFT / EM MAINT / OP SAID HE WAS SCARED TO DRIVE THE BUS / ST / MLX WILL DRIVE BUS TO DIV / OP WILL WRITE UP IN DOT BOOK
2/7/2018 3:31:00 PM,2387971,5143,40,85,0022,STOP ENGINE AND LOW COOLANT LIGHTS; -85 MIN
2/7/2018 3:29:00 PM,2387945,9324,83,5,0022,CHECK ENGINE LIGHT AT THE GARAGE.
2/7/2018 2:36:00 PM,2387909,9345,20,10,0705,NOT GO IN TO GEAR /OPP RESET GOT TO GO /OK RUN LATE
2/7/2018 5:17:00 AM,2387765,3932,77,123,0022,STOP ENGINE LIGHT; BUS DIED; DROPPED 3 TRIPS; -123 MIN
2/7/2018 7:08:00 AM,2387740,5009,100,48,0160,FLAT TIRE; PULL OUT DELAY; -48 MIN
2/6/2018 5:25:00 PM,2387451,3708,FF,37,0610,THE ENGINE DIED OUT. MLX BLOCK 81 ON SPACE FROM DUS.
2/6/2018 4:37:00 PM,2387448,5094,30L,15,0160,THE STREET SIDE REAR INSIDE TIRE IS FLAT. CC ADVISED.
2/6/2018 4:40:00 PM,2387422,3908,92,29,0160,FLAT TIRE -29 MINS
2/6/2018 2:34:00 PM,2387379,3932,77,26,0022,COOLANT TEMP -26 MIN
2/6/2018 3:13:00 PM,2387353,9339,0L,6,0022,CHECK ENGINE LIGHT ON.
2/6/2018 11:43:00 AM,2387231,6020,0,11,0030,ST/ BACKDOOR NOT CLOSINGý TRIED AIR PRESSUREý PUSHING AND SHUTTING DOWN THE BUS/ DID NOT WORK/ OPERATOR ABLE TO CLEAR AFTER SEVERAL TRIES/ PAX BOARDED FOLLOWER/ OPERATOR WILL BYPAS
2/6/2018 7:13:00 AM,2387120,6154,51,46,0022,WARNING LIGHT -46 MNINS
2/6/2018 6:59:00 AM,2387114,3918,403,71,0610,ENGINE STALL -71 MIN
2/6/2018 4:37:00 AM,2387033,3809-R-2000,JUMP,10,0720,ST/ OPERATOR CALLED STATING HE LOST HIS TRANSMISSION/ WILL NOT GO INTO GEARý OIL CHECKED OUT OKAYý WILL SHUTDOWN AND RESTART/ INFO TO FTL
2/5/2018 4:37:00 PM,2386843,1528,P,25,0022,THE BATTERY LIGHT ANT EH ESS LIGHT CAME ON WITH THE BUZZER.
2/5/2018 2:54:00 PM,2386842,6250,31,6,1350,CHECK AND STOP ENGINE AND LOW COOLANT. THE ENGINE DIED OUT.
2/5/2018 2:41:00 PM,2386751,5109,28,52,0505,NO START; -52 MIN
2/5/2018 2:22:00 PM,2386735,3921,402L,98,0022,STOP ENGINE; MELTED WIRES AROUND EXHAUST PIPES; MISSED 3 TRIPS; -95 MIN
2/5/2018 12:10:00 PM,2386731,6069,15,62,0030,REAR DOOR IS STUCK OPEN. THE REAR DOOR CLOSED WHEN THE OPERATOR SHUT THE BUS DOWN. OPERATOR ADVISED TO STOP USING THE REAR DOOR. BUS TRADED OUT AT EM. SEE DVIR. OPERATOR PULLED OUT
2/5/2018 11:09:00 AM,2386681,6335,16,64,0022,LOW FLUID LIGHT ///CALLED 316 TO MEET 1136 LINCOLN AND 16TH/// RESPACED TO FED CTR /ALSO INVOLVED INCIDENT WITH PARAMEDICS
2/5/2018 8:25:00 AM,2386599,6134,27,28,0405,COOLANT LEAK; -28 MIN
2/5/2018 5:57:00 AM,2386565,6038,16,13,0405,SMALL COOLANT LEAK //TK 316 TO MEET 629 LINCOLN AND 16TH//CKD BUS NEEDS TRADE //CALLED RR TO ARRANGE
2/5/2018 6:19:00 AM,2386531,1538,104X,6,1005,NO POWER TO LIFT/
2/5/2018 5:10:00 AM,2386526,5146,6,61,1005,LIFT LIGHT FLASHING; BUS WON`T MOVE; -61 MIN
2/4/2018 12:55:00 PM,2386336,6162,145X,36,0405,COOLANT LEAK; -36 MIN
2/4/2018 1:36:00 PM,2386317,LRV231,101,17,3136,FLOOR DEADMAN NOT FUNCTIONING. OP HAD TO USE THUMB TO MOVE TRAIN. BURIED LRV 231B.   CAB B
2/4/2018 12:46:00 PM,2386308,6121,0,26,0012,LUMBAR STUCK/ HARD TO DRIVE/ TRADE OUT/ RUN IT LATE
2/4/2018 12:29:00 PM,2386300,9376,15L,61,0505,CALLED EM RR TO SEND TRUCK AND TRADE // CURTAILED TRIP AND RESPACED TO DECATUR STN //
2/4/2018 10:29:00 AM,2386267,LRV311,101,10,3139,OP STATED THAT HE WAS DRAGGING BRKSý NO LIGHTS ON THE OUTSIDE OF CONSIST AND STATED NOTHING ON HIS V.O.D CAME UP AS TO WHICH LRV AND TRK WAS HAVING THE ISSUES. LRVS` IN CONSIST WER
2/4/2018 9:32:00 AM,2386249,6334,16,29,0022,CHECK ENGINE/LOW COOLANT LIGHT ON. TRADE AT BACK DOOR. OP MISSED STARTING TERMINAL START AT DECATUR STN. 1012; LOSS 29 MINUTES
2/3/2018 7:26:00 PM,2386091,9316,15L,18,0022,CHK ENG STOP ENG LOW COOLANT LIGHTS ON ALARM ON// CALLED EM TO SEND TRK OUT ON ANOTHER CALL //CURTAILED TRIP /// LAST TRIP BAD COOLANT SENSOR
2/3/2018 7:15:00 PM,2386078,6112,65,30,0505,ENGINE NOT STARTING; TRY REAR START; AFTER TRADE RESPACE TO CENTRAL PARK STATION FOR 755 LV. TIME
2/3/2018 3:21:00 PM,2386024,LRV217,101,15,3132,PROPULSION FAULTý LONG KEY OUT/UP DID NOT CLEARý TURNED INTO TCU. WILL NOT CLEARý VERIFIED NOT DRAGGINGý AT RESTRICTED. DUE TO TIME DOWN AND RELIEF NEXT TRIP PULL IN AND TRADE OUT
2/3/2018 1:45:00 PM,2385980,5146,40,39,0028,CAN`T CLOSE FRONT DOOR; SERVICE TRUCK; -39 MIN
2/3/2018 12:28:00 PM,2385957,6311,105,51,0160,INNER RIGHT REAR DUAL FLAT; E/M RESPONDING. RESPACE TO SOUTHMOOR P/R FOR N/B TRIP; LX CHECKING TIREý FOUND CHUNK OF CEMENT WEDGED BETWEEN THE DUALS.
2/3/2018 8:34:00 AM,2385898,6298,38,6,0040,THE WIPER BLADE CAME OFF ON THE STREET SIDE. T316 RESPONDED AND CLEARED THE BUS TO CONTINUE. OPERATOR RUNNING 6 MINUTES LATE.
2/2/2018 7:46:00 PM,2385719,6115,153,35,0225,PARKING BRAKE PIN FELL OUT OF THE KNOBý S39ý OPERATOR RESP TO COLFAX/SABLE 9:33
2/2/2018 7:31:00 PM,2385637,6279,135,59,0705,TRANSMISSION WONT GO IN GEARýEMRRýT-TRUCK IN RT//MLX BLOCK 11 ON SPACE FROM 9MILE PNR.
2/2/2018 5:03:00 PM,2385611,1527,RX,7,0505,PULL OUT DELAY DUE TO A NO START.
2/2/2018 2:37:00 PM,2385606,5009,21,31,0022,CHECK AND STOP ENGINE LIGHTS; -31 MIN
2/2/2018 5:47:00 PM,2385604,9316,83,48,0022,STOP ENGINE LIGHT. RE-SPACED TO LINCOLN/16TH.
2/2/2018 5:09:00 PM,2385578,6250,3,50,0022,STOP ENGINE/ CK ENGINE/ ENGINE HOT/ NO LEAKS OR BROKEN BELTS OBSERVED/ T-316 RESPONDING/ BUS WILL BE SENT BACK TO PLATTE / T-TRUCK TO FOLLOW
2/2/2018 4:13:00 PM,2385564,3742,EV,50,0160,CURBSIDE FRONT TIRE BLOWN //CALLED PLATTE RR TO SEND TRK//CALLED 1547 TO ACCOMMODATE PAX (2) ON BUS // CURTAILED TRIP AND CALLED MLX 12 BUS NO 1532 TO RUN SPACE ON CX//
2/2/2018 3:27:00 PM,2385549,6336,0,25,0405,LOW COOLANT LIGHT NO LEAKS / T316 TOPPED OFF
2/2/2018 3:49:00 PM,2385498,LRV265,101,3,3100,2Xý LRV 265-B TRUCK FRICT BRAKE FAULT. BOTH TIMES KEY DWN / UP CLEARED.   CAB B
2/2/2018 10:16:00 AM,2385377,6113,15,59,0030,REAR DOOR WONT OPEN AND BUS WONT MOVE //DID TS / CANT GET MOVING // CALLED RR AT EM TO CHK OUT//REPAIRED AND CLEAR AT 1100 /RESPACED TO DOWNING ST EB AT 1114 CURTAILED TRIPS//
2/2/2018 7:54:00 AM,2385344,1996,BOLT,85,0150,TAG AXEL WAS OSCILATING. BACK AND FORTH. DANGEROUS. OPER WAS WROTE UP YESTERDAY. S/T. S38. TO FOLLOW BUS TO GARAGE. KEVIN SMITH INSPECTOR; ADV BUS WAS SAFE AFTER TESTING THE BUS; T
2/2/2018 5:45:00 AM,2385342,3975,483,61,0405,COOLANT LEAK; -61 MIN
2/2/2018 9:51:00 AM,2385337,6058,0,29,0505,UNABLE TO GET BUS STARTED/ TRIED REAR START/ CK BUS/ CK OK/ T-316 RESPONDING TO ASSIST BUS.///CALLED MLX 2 TO RUN SPACE FROM I25 AND BROADWAY TO HRPNR //TO TRANSFER PAX AT ENGLEWOO
2/2/2018 7:31:00 AM,2385323,3829-R-2000,JUMP,68,0038,SOMETHING DRAGGING UNDER FRONT OF BUS; -68 MIN
2/2/2018 6:28:00 AM,2385250,5193,225,67,0405,COOLANT LEAK; -67 MIN
2/2/2018 6:07:00 AM,2385223,5260,121,5,1005,WONT GO INTO GEAR; ADV LIFT DRIFT; NO ADA. OK NOW.
2/2/2018 5:12:00 AM,2385217,9349,120X,12,0505,NO START; PLRR ON SCENE.
2/2/2018 4:30:00 AM,2385207,6121,12,50,0022,STOP ENGINEý MILý LOW COOLANT LIGHT/ BUS SHUT DOWN/ MLX 10 BUS 6105 ON SPACE FROM SB CORO COLF 520AM -555AM / RESPACED TO ENGL STN 607AM
2/1/2018 11:07:00 PM,2385047,LRV319,101,10,3132,NON MOVING LRV TRADED AT MINERAL   CAB B
2/1/2018 6:55:00 PM,2384996,5219,Y,33,0610,ENGINE STALL -33 MINS
2/1/2018 3:56:00 PM,2384960,5219,Y,57,0405,COOLANT LEAK -57 MIN
2/1/2018 2:16:00 PM,2384949,6075,15,36,0001,WET PAX SEAT /PULLIN EM WAIT FOR BUS ./TRADE RESP COLO CLFX RUN LATE
2/1/2018 2:52:00 PM,2384916,9316,169L,13,0022,STOP ENGINE/COOLANT LIGHT ETC/ST/MLX T/T317
2/1/2018 1:12:00 PM,2384888,6261,15,15,0022,CALLED RR /OP SAID FELT UNSAFE DRIVING BUS STUCK IN HIGH IDLE // SENT MECH OUT TO CK `//GOOD BUS NOW //TOLD TO RUN LATE AND CALL WHEN GET TO DUS
2/1/2018 11:04:00 AM,2384815,LRV222,101,3,3127,POSSIBLE WIRE TO TRACK BRAKE DISCONNECTED ON C-TRUCK. LRV-323 / C. TRADE AT MINERAL.   CAB A
2/1/2018 5:59:00 AM,2384760,1517,CV,70,0605,BUS DERATED // WONT GO OVER 30-35MPH // TOLD OP TO PULL INTO MOUNTAIN VIEW PNR AND WAIT ON TRUCK //CALLED 1521 TO ACCOMMODATE PAX ///T TRUCK ON SCENE AND OP CANT GET BUS TO WORK CO
2/1/2018 5:20:00 AM,2384692,LRV111,76,17,3114,DOORS ON LRV WONT RELEASE. BREAKERS DID NOT WORK. CANNOT MOVER TRAIN FROM EITHER END. CUT OUT DOOR. MOVED PASS TO FRONT LRV. NEXT STATION NONE OF THE DOORS WOULD OPEN. TRADE OUT WI
1/31/2018 9:28:00 PM,2384549,6041,3,34,0022,ST CHECK AND STOP ENGINE LIGHTýOPERATOR WILL RUN THE TRIP 34 MINUTES LATE.
1/31/2018 5:37:00 PM,2384517,3921,35,10,0705,BUS WONT MOVE AFTER USING THE KNEELING SYSTEM/ TD/ OPERATOR ABLE TO GET BUS MOVING TD WILL MEET IN RTE
1/31/2018 5:35:00 PM,2384511,6173,11,35,0160,FLAT TIRE; -35 MIN
1/31/2018 6:38:00 PM,2384502,2223,14,10,0305,FRNT AIR LEAK /ST /TRADE MLX 78
1/31/2018 6:12:00 PM,2384473,LRV111,107,5,3138,TCU FAULT REAR LRV-111. KEY DWN / UP DID NOT CLEAR. OP. PARKS @PEORIA. NO BRAKE DRAG. RAN IN SERVICE TO PEORIA.   CAB A
1/31/2018 3:32:00 PM,2384396,5262,131,22,0305,PULL OUT DELAY DUE TO AIR PRESSURE ISSUES BECAUSE OF OPERATOR ERROR.
1/31/2018 3:02:00 PM,2384371,3921,35,12,0305,LOW PSI /OPP GOT TO GO /WRITE UP /RUN LATE
1/31/2018 2:34:00 PM,2384359,6154,100,115,0022,STOP ENGINE AND LOW VOLTAGE LIGHTS; LEAKING FLUID; DROPPED 1.5 TRIPS; -115 MIN
1/31/2018 1:54:00 PM,2384347,1513,FF,10,1020,INTERLOCK MALFUNCTION/WILL NOT RELEASE/MECH GOT IT GOING/TRADE IN BOULDER
1/31/2018 10:54:00 AM,2384294,1409,STMP,37,0625,ST/ OIL LEAK/ RESPACE TO MARINE 30TH FOR THE 1155A TRIP
1/31/2018 8:52:00 AM,2384253,9369,15L,68,0022,CK ENG. STOP ENG. S/T. RESP-1016A
1/31/2018 6:59:00 AM,2384238,2100,12,68,1020,LIFT STUCK OUT/PAX ACCOM BY FOLLOWER BEFORE TRUCK ARRIVED/BACK TO PL FOR 2000 FOR SHOP SPEC
1/31/2018 6:35:00 AM,2384224,5222,225,50,0610,STOP ENGINE LIGHT; DROPPED 1.5 TRIPS; -50 MIN
1/31/2018 7:13:00 AM,2384205,1504,FF,11,0705,ASKING FOR A TRUCK TO MEET/ TRANS GETS STUCK IN 4TH GEAR/ ON BDWY SOUTH OF COLF/ GOOD BUSý COULD NOT FIND THE PROBLEM
1/31/2018 6:20:00 AM,2384203,9370,83,35,0022,STOP ENGINE/LOW COOLANT/BUS SHUT DOWN/PAX ACCOM BY FOLLOWER/MLX3 TRADE/RESPACE TO 1ST UNIV SB 0657
1/30/2018 10:51:00 PM,2383984,5022,31,46,0125,KNEELING SYSTEM PROBLEM -46 MINS
1/30/2018 3:27:00 PM,2383934,1503,AB,33,0046,IC LIFT DOOR NOT LATCHING /DASH LITE BUZZER /EM RR TRD /FOLLOWER WAS ABLE TO TEMP REPAIR SENSOR TO GET TO DTBS /BO RR SEND TRADE
1/30/2018 5:53:00 PM,2383910,3724,J,10,0160,CURBSIDE TAG AXLE TIRE FLAT/BLDR NO TRUCK/PL/LAST TRIP/PAX ACCOM BY FOLLOWER
1/30/2018 2:16:00 PM,2383860,3930,27,15,0022,WARNING LIGHTS -15 MIN
1/30/2018 12:49:00 PM,2383796,LRV310,101,15,3128,APS INVERTER FAULT. PULLED OOS. TRADED CONSIST.   CAB A
1/30/2018 12:18:00 PM,2383772,LRV223,101,1,3100,B-CLASS FRICTION BRAKE FAULT ON LRV-223. KEY DOWN / UP CLEARED FOR NOW.   CAB A
1/30/2018 6:27:00 AM,2383677,1532,RX,72,0028,DOOR WILL NOT CLOSE/S23 CONFIRMS/PAX ACCOM BY FOLLOWER/TRUCK FIX/PULL IN
1/30/2018 6:03:00 AM,2383666,2100,87L,56,1020,LIFT STUCK OUT/TRUCK FIX/RUN LATE/FOLLOWER ON 12 ON TIME/RESPACE TO DOWNING ALAMEDA NB/TRIP CURTAILED/MLX4 TRADE
1/30/2018 6:28:00 AM,2383642,3850,208,6,0028,FRONT DOOR PROB;WONT OPEN.
1/29/2018 2:59:00 PM,2383311,5130,31,30,0030,REAR DOOR; -30 MIN
1/29/2018 4:05:00 PM,2383280,6156,21,70,0160,FLAT TIRE; -70 MIN
1/29/2018 1:16:00 PM,2383246,3972,27,114,0705,CHECK ENGINE; TRANS; NO POWER; -114 MIN
1/29/2018 2:07:00 PM,2383231,6335,12,13,0022,LOW COOLANT LIGHT. FRONT END SUSPENSION IS SHAKING. T316 RESPONDING. T316 CLEARED BUS TO CONTINUE BUT REQUESTING A BUS TRADE DUE TO A BAD SENSOR. MLX/6 MAKING TRADE.
1/29/2018 11:01:00 AM,2383182,3629,FF,60,1020,CANT GET THE LIFT TO STOW. THE RELIEF OPERATOR WAS RE-SPACED TO DUS.
1/29/2018 10:22:00 AM,2383168,6169,31,18,0610,CHECK ENGINE; LOW COOLANT; -18 MIN
1/29/2018 7:11:00 AM,2383054,6114,131,13,0022,OPERATOR STATED HIS BUS KEEPS STALLINGý LOW COOLANT LIGHTý TO EM RR/ COOLANT SENSOR PROBLEM/ TRADE
1/29/2018 5:49:00 AM,2383022,1511,GS,8,0635,SS62 REPORTING THIS BUS WAS SMOKING. OPERATOR PULLED OUT LATE DUE TO A BUS TRADE. ARRIVED TO THE START TERMINAL AT 5:51AM.
1/29/2018 7:00:00 AM,2383019,5140,131,5,0024,SS36 MAGUIRE REPORTING THIS BUS WAS TRADED OUT AT PULL OUT BECAUSE THE HORN WASN`T WORKING. OPERATOR PULLED OUT LATE AND ARRIVED TO THE START TERMINAL 7:11AM.
1/29/2018 5:46:00 AM,2383018,6121,3,107,0022,CHECK ENGINE LIGHT IS ON AND THE WHEEL CHAIR LIFT WARNING LIGHT IS ON. OPERATOR WAS ADVISED TO CYCLE THE LIFT TO SEE IF HE COULD RESET THE WARNING. BUS SHUT DOWN AND WOULD NOT REST
1/29/2018 5:17:00 AM,2382960,3931,403,6,0305,LOW AIR PRESSURE; PULL OUT DELAY; -6
1/28/2018 3:12:00 PM,2382807,5258,11,52,0160,FLAT TIRE; -52 MIN
1/28/2018 2:42:00 PM,2382800,5001,51,62,0160,FLAT TIRE CALLED IN BY PAX FIRST; -62 MIN
1/28/2018 2:27:00 PM,2382794,9378,15L,58,0405,HOSE BUSTED/ T-316 RESPONDING/ LOOP 2 TO TRADE OUT/PAX TO TAKE FOLLOW BUS/ NEW BUS RESPACED TO COLFAX & BILLINGS/36 PM/ W/B TRIP/ OLD BUS TO GARAGE
1/28/2018 3:38:00 AM,2382666,6183,145X,5,0525,HEADLIGHTS WONT WORK//GOT REPAIRED BACK IN ROUTE
1/27/2018 6:56:00 AM,2382400,6339,48,39,0022,LOW COOLANT AND TEMP LIGHT ON //TRUCK WILL MEET AT 13TH AND WELTON //GOOD BUS NOW RESPACED TO MONACO AND 69TH CURTAILED TRIP//
1/27/2018 1:58:00 AM,2382248,2080,169,5,0310,AIR LEAK /TRADED ON PULLOUT //
1/26/2018 4:07:00 PM,2382151,5001,31,14,0022,STOP ENGINE/ AUDIBLE ALARM /NO LEAKS / BELTS OKAY/ UNABLE TO GET BUS GOING/ ADVISE TRANSDEV./ LOOP 7 TO PU SPACE/ 4:48PM TO 6:01 PM/ US 36 & SHERIDAN TO FEDERAL & EVANS
1/26/2018 3:37:00 PM,2382100,3651,FF,5,0028,LATE PULL OUT DUE TO ISSUES WITH THE FRONT DOOR NOT OPENING.
1/26/2018 3:03:00 PM,2382060,LRV124,101,2,3119,OPR SAID THE PROTRAN IS NOT WORKING ON LRV124A CAB   CAB A
1/26/2018 11:20:00 AM,2382022,6265,34,83,0022,CHECK ENG AND LOW COOLANT LIGHTS ARE ON / OP CLR TO EM FOR NEW BUS / NO LX AVAIL / OP RESP 30TH/DWN STA 1:17P
1/26/2018 1:38:00 PM,2382020,6296,0,10,0030,UNABLE TO CLOSE BACK DOOR/LX T/MLX OP WAS ABLE TO CLOSE THE REAR DOOR AND MECHANIC WAS CANCELLED
1/26/2018 7:51:00 AM,2381925,6220,DASH,118,0022,NO CHARGE/BUS DIED/BLDR MAINT NO BUS-SAYS QC IS DOWNING THEM/RECALL AT 0835/TRIPS CANCELLED/THEY FOUND A BUS AT 0844/NEEDS TOW/PL/RESPACE TO TBMS EB 0953
1/26/2018 8:15:00 AM,2381921,9380,83,40,0028,FRNT DOOR IS STICKING.
1/26/2018 7:46:00 AM,2381915,5171,40,49,0160,FLAT TIRE; DROPPED 1 TRIP; -49 MIN
1/26/2018 7:22:00 AM,2381893,9301,15L,33,0215,SMOKING CURBSIDE WHEEL//CALLED T TRUCK 316 TO CK// 15TH AND CURTIS/MECH SAYS VERY HOT BRAKES/TO PL FOR TRADE/RESPACE TO COLFAX BDWY 0820
1/26/2018 6:13:00 AM,2381875,5002,51,97,0160,FLAT TIRE; -97 MIN
1/26/2018 4:18:00 AM,2381810,6038,38,48,0022,CHK ENG LIGHT //COOLANT LEAK //CALLED T TRUCK 316 TO GO MEET 38TH AND YOUNGFIELD / CANCELLED FIRST TRIP //RAN SECOND TRIP LATE
1/26/2018 2:22:00 AM,2381691,6092,105,22,0022,LIFT LIGHT ON// SENT BACK TO EM TO GET ANOTHER BUS // RUN LATE GOT TO TERMINAL AT 300A// ASSIGNED ROUTE IN CASR
1/25/2018 5:06:00 PM,2381674,6083,15,68,0525,TURN SIGNAL LIGHT STUCK ONý OPERATOR RE SPACED TO COLFAX/BILLINGS WB 6:54 PM
1/25/2018 7:47:00 PM,2381615,LRV231,101,5,3100,OPR SAID THAT THE DISC BRAKES WOULD COME ON TOO EARLY AND THAT IT SMELLED LIKE BRAKES IN LRV 231. NO FAULTS AND NO PERFORMANCE PROBLEMS.   CAB A
1/25/2018 5:44:00 PM,2381605,6024,21,40,0310,BUS HAS PSI LEAK / T-316 / OP WILL RUN RTE LATE / OP RESP EVANS STA 6:31P / OP WILL RUN RTE LATE / MLX CLR TO DIV
1/25/2018 5:05:00 PM,2381593,9338,122X,11,0038,LOOSE MIRROR/31ST TRADE RUN LATE CCS CALLED/WRITE UP
1/25/2018 6:00:00 PM,2381584,LRV251,101,10,3100,TWICE RECEIVED FRICTN BRK FAULT AND BROUGHT TO STOP. ALSOý A PROP FAULT THAT BROUGHT TRAIN TO STOP. KEY OUT/IN CLEARED EACH TIME. TRADED W/ LRX.50 AT BROADWAY NB.   CAB B
1/25/2018 4:06:00 PM,2381524,5055,8,11,0038,METAL HANGING OF FRONT
1/25/2018 4:41:00 PM,2381518,LRV203,101,4,3103,NO COMMS WITH TWC LOOPS. BREAKER RESET DID NOT WORK. BURY CAB. MADE CALLS FOR OPERATOR WITH SCADA.   CAB A
1/25/2018 11:35:00 AM,2381381,6336,0,10,0705,BUS WONT GO INTO GEAR / T-316 / OP ABLE TO GET BUS INTO GEAR / OP CLR TO CONT RTE
1/25/2018 11:00:00 AM,2381355,6020,16L,10,0030,OPERATOR DELAYED BECAUSE HE COULDN`T GET THE BACKDOOR TO CLOSE/ WILL TRY TO USE FRONTDOOR OPERATION ONLY/ OPERATOR TRIED AGAIN AND DOOR WAS WORKING OKAY
1/25/2018 7:49:00 AM,2381309,6281,42,33,0205,NOT STOPPING THE BUS. ST. S37; OPER WILL DROP OFF ONLY; FOLLOWER CAUGHT UP;EMPTY AT 47TH/PEORIA RESP TO ORLN MAXW 839AM
1/25/2018 7:02:00 AM,2381262,9380,15L,4,0405,FLUID LEAKING ALL OVER FLOOR BEHIND SEAT/PULL IN DURING RECOVERY/COOLANT LEAK/BACK DOOR TRADE/RUN TRIP LATE
1/25/2018 6:38:00 AM,2381238,3925,402L,2,0610,ST/ BUS DIED AFTER LETTING A PAX OFFý OPERATOR HAS TRIED TO RESTARTý BUS NOT STARTING TO TD
1/25/2018 5:35:00 AM,2381218,3637,FF,16,0022,3637 UKN WARNING LIGHTS. BORR TRD BUS. RNSP LATE.
1/25/2018 5:52:00 AM,2381216,6121,1,16,0022,SIGNOUT; LTURN SIGNAL NOT WORKING. RESP 623AM
1/24/2018 11:36:00 PM,2381051,6112,15,46,0405,DUS B8/COOLANT LEAK /PL RR T316/1202A/FOLLOWER /ACCMD PAXý PLATTE WILL TOW THE BUSý EAST METRO DOESN`T HAVE ANYONE FOR THE TOW.
1/24/2018 3:43:00 PM,2380993,5142,121,130,0022,CHECK ENG LIGHT IS ON / EM / TRUCK T-317 WILL MEET OP / SENT MLX TO TRADE BUSES MLX GOT LOST 3 TIMES / SENT MLX TO EM DIV / REG OP DROVE BUS TO EM
1/24/2018 6:12:00 PM,2380986,1535,AT,39,1005,THE LIFT IS STUCK OUT WITH A PASSENGER ON IT. S21.
1/24/2018 2:24:00 PM,2380884,3623,FF,95,0160,TAG AXLE TIRE LOST ON HIGHWAY/BO/NOTIFIED NEXT BUS TO ACCOM PAX/TRIPS CANCELLED/NO LOOP AVAILABLE/DUS NOTIFIED/RESPACE TO DBS 420
1/24/2018 12:58:00 PM,2380821,6087,15,42,0610,ST/ CHECK TRANSMISSION LIGHT/ BUS CHECKS OUT FINE/PER MECHANICý RESPACE TO COLF HAVANA 202P
1/24/2018 11:55:00 AM,2380777,6103,15,15,0610,ST/ BUS HAS DIED/ TRUCK AND TRADE SENT/ CHECK TRANS LIGHT/ RESPACE TO COLFAX AND BDWY @1237A/ WILL FOLLOW BACK TO EM DIVISION @1226P/ PROBLEM WITH TRANSMISSION FLUID
1/24/2018 6:47:00 AM,2380726,5246,20,169,0505,NO START; DROPPED 2 TRIPS; -169 MIN
1/24/2018 6:36:00 AM,2380655,3938,87L,10,0022,CHECK ENGINE LIGHT; PULL OUT DELAY
1/24/2018 5:53:00 AM,2380648,5158,10,1,1020,NO ADA; RAMP IS NOT DEPLOYING.
1/24/2018 3:58:00 AM,2380620,6020,12,99,0160,FRONT CURBSIDE TIRE HAS BLOWN ON THE HIGHWAY. BUS IS SIDE TRACKED. PLATTE MAINTENANCE WAS NOTIFIED AND SENT A T-TRUCK. BUS RE-SPACED TO ENGLEWOOD STATION AT 6:07 AM
1/23/2018 8:09:00 PM,2380442,LRV144,107,5,3114,DOOR 14 CLOSED OUT.   CAB B
1/23/2018 4:14:00 PM,2380350,6111,34,17,0605,2ND GEER/SLOW/TRD MLX 15 C PARK/437P/RUN LATE
1/23/2018 4:17:00 PM,2380316,LRV300,101,1,3131,OP. SAYS MAJOR FAULT LIGHT ON. #340 RODE TRAIN EXPLAINED THE VOD GOES BLANK WHEN TRYING TO GO TO MECH SCREEN. NO PERFORMANCE ISSUES. BEEF SHEET REQUESTED. LRV-300-B   CAB B
1/23/2018 11:29:00 AM,2380253,6285,15,80,1015,OP REPORTED THE W/C RAMP HAS A PIECE OF METAL STICKING UP / T-316 / NO MLX AVAIL / OP TO EM FOR NEW BUS / EM MAINT / TRADE WILL BE IN EM DRIVE / OP WILL WRITE UP IN DOT BOOK / OP R
1/23/2018 12:35:00 PM,2380225,5086,6,56,0160,FLAT TIRE -56 MINS
1/23/2018 11:31:00 AM,2380214,5041,Y,30,0160,ST/ FLAT TIRE/ LEFTSIDE REAR DUAL/ ALL PAX EXITED/ TRIANGLES PUT OUTý TO FTL DISPATCH
