DATETIME_OCCURRED,INC_ID,VEHICLE_ID,ROUTE,DELAY_MINUTES,SYMP_SYMPTOM,DESCRIPTION
9/14/2017 6:06:00 AM,2309710,6271,AA,15,0022,ST/ CHECK ENG/ DEF LIGHT/ WITH ALARMSý DISCONNECTED THE SENSOR BUT THE ALARM IS STILL GOINGý AIRPORT MLX 38 SENT
9/14/2017 5:21:00 AM,2309680,5231,29,10,0525,ST/ OPERATOR STATED HE HAS LOST ALL ELECTRICAL/ ON BRIGHTON
9/14/2017 3:12:00 AM,2309566,LRV142,103,2,3138,LRV HAD TCU AND BLOWER FAULTS. KEYED OUT/UPý THREW BREAKERS. DID NOT CLEAR. CUT LRV OFF AT AW AND BROUGHT BACK TO MARIPOSA   CAB A
9/13/2017 9:21:00 PM,2309546,6012,21,14,0505,NO START// CALLED PULLIN BUS TO TRADE AND CALLED EM TO SEND TRUCK// RAN LATE
9/13/2017 8:56:00 PM,2309519,LRV201,101,38,3101,LRV 201 TRAINING TRAIN AT CONV CTR NO FAULT ON VOD/NO LGHTS. LRV WOULD MOVE 2 FT THEN STOP MULTIPLE THINGS TRIED TO GET TRAIN TO MOVE WITH NO SUCCESS. IN SVC TRN TAKEN OOS AND COUP
9/13/2017 8:29:00 PM,2309515,1536,AT,11,0022,2 EXHAUST LIGHTS AND CK ENGINE LIGHT ON WILL TRADE AND CALLED SS21 TO ASSIST WITH LUGGAGE //TRADE MADE AND IN ROUTE
9/13/2017 6:51:00 PM,2309483,6068,121,60,0210,BRAKES LOCKED/ST/T287/MLX 5/FOLLOWER ///RESPACE TO 40TH AND AIRPORT 815// CANCELLED TRIP
9/13/2017 5:06:00 PM,2309480,9350,100L,63,0610,ST CHECK ENGINEýSTOP ENGINE LIGHTSý BUS STALLED.BUS WAS SENT TO THE GARAGEýTHE FOLLOWER HAD PAST.
9/13/2017 6:04:00 PM,2309470,6088,169,39,0160,CURBSIDE REAR OUTER DUAL TIRE FLAT //CALLED EM WILL SEND BUS AND T TRUCK TO CHANGE TIRE ///GOT TRADE AND RESPACED TO NB TRIP AT BUCK/HAMP AT 658// CURTAILED TRIPS
9/13/2017 6:10:00 PM,2309453,LRV290,101,5,3103,TWC NOT WORKINGý CIRCUIT BREAKER WILL NOT RESETý NOT PICKING UP ANY INFO AT LOOPS/NOT ROUTING.   CAB A
9/13/2017 5:38:00 PM,2309448,LRV258,101,3,3114,OPERATOR CUT OUT DOOR 11 WOULDN`T CLOSE.   CAB A
9/13/2017 4:39:00 PM,2309443,6175,11,10,0022,CHECK ENG LITE IS ON / OP WILL WRITE UP IN DOT BOOK
9/13/2017 4:57:00 PM,2309432,6269,121,65,0610,STOP ENGINE . BUS SHUT DOWN/NO MLX/ CLEARED TO DIV
9/13/2017 4:03:00 PM,2309431,5095,36L,30,0505,NO START; LOOP P/U SPACE; -30 MIN
9/13/2017 10:30:00 AM,2309236,LRV132,107,1,3106,TRAIN-24 ATS PULLING INTO PEORIA IN LRV-132A.   CAB A
9/13/2017 6:09:00 AM,2309153,LRV103,107,2,3114,TRAIN-25 REPORTED CUTTING OUT DR-12 ON LRV-103ý DUE TO DOOR NOT CLOSING COMPLETELY.   CAB A
9/12/2017 8:43:00 PM,2308979,5118,76,43,0022,CHECK ENGINE LIGHT -43 MINS
9/12/2017 7:31:00 PM,2308927,6299,6,12,0022,CHECK ENG LIGHT IS ON / EM / TRUCK WILL MEET OP AURO STA
9/12/2017 2:47:00 PM,2308771,LRV138,107,15,3138,TR. 25 LRV 138 A. OP RPT TCU AND MCB FAULTS. OP WAS UNABLE TO CLEAR THE FAULTS AND WILL FILL OUT DEFECT SHEET.   CAB A
9/12/2017 12:41:00 PM,2308751,5095,31,17,0505,NO START -17 MINS
9/12/2017 9:04:00 AM,2308735,5262,105,25,0610,NO CHARGE L;OW VOLT LIGHT/ BUS SHUT DOWN/ CALLED EM RR T286ý T 316 WILL JUMP START/ MLX 10 BUS 6064 ON SPACE FROM HAVA ILIF 943AM-1126AM
9/12/2017 11:19:00 AM,2308719,6301,133,80,0160,CURB SIDE TIRE GOING LOWý TRUCK TO MEET/ TRADE BEING SENT TO LOCATION/ WILL HEAD TO RELIEF POINT AFTER TRADE/ RESPACE NINE MILE 126P
9/12/2017 11:20:00 AM,2308691,LRV310,101,10,3134,BLOWER FAULTSý APS POWER SUPPLY. MIDDLE CAR 310.   CAB A
9/12/2017 8:02:00 AM,2308632,6293,121,86,1020,ST/ RAMP LIGHT ONý BUS WON`T MOVEý THIS HAPPENED IN THE TURNING LANE AT DELMAR/ MECHANIC FROM EM/S24 SOLANO BEING SENT/ INTERLOCK OVERRIDE USED TO MOVE THE BUS / SHUTDOWN TO RESETý
9/12/2017 6:35:00 AM,2308597,9355,72L,11,0022,ST/ STOP ENGINE LIGHT AND LOW COOLANT/ 3655 WILL ACCOMMODATE PAX INTO DUS/ SENSOR PROBLEMý DRIVE TO PLATTE FOR TRADE/ WILL BYPASS LIFT AREA AND RUN TRIP LATE ON THE 72L 63
9/12/2017 5:59:00 AM,2308553,1514,GS,30,0405,ST/ WATER TEMP/ CHECK ENGINE/ COOLANT LEAK TO BO DIV/ TRADE WITH BLOCK 5/ RAN BOTH BLOCKS AND RETURN TRIP LATEý FOR BLK 4
9/12/2017 5:28:00 AM,2308535,1532,P,20,0605,CHECK ENGINE LIGHT CAME ON AND BUS WILL NOT GO OVER 20 MPH
9/12/2017 5:04:00 AM,2308471,LRV238,101,15,3112,GOING AROUND 14TH/CAL RECEIVED LOW POWER SUPPLY PROP FAULTS CLASS B ALSO BLOWER FAULT ON 238ý ALL 3 CAR HAVE WHITE LIGHTS. 315-214-238.   CAB A
9/12/2017 4:42:00 AM,2308411,LRV232,101,5,3132,PROP FAULTS CLASS B WOULD NOT CLEAR AFTER LONG KEY DOWN/UPý COASTING FREELY WILL RETURN TO ELATI.   CAB A
9/11/2017 11:06:00 PM,2308301,3724,BOLT,24,0160,HUB SEAL CAME OFF AND FLUID IS LEAKING OUT OF THE REAR DUAL TIRE. BO MAINTENANCE RESPONDING. BUS CLEARED TO CONTINUE BY THE MECHANIC.
9/11/2017 5:38:00 PM,2308145,3912,46,72,0028,DOORS WONT OPEN; TRADE; -72 MIN
9/11/2017 5:24:00 PM,2308144,5259,100,28,0505,NO START; TRAADE; -28 MIN
9/11/2017 1:43:00 PM,2307982,LRV294,101,15,3100,TR. 57 LRV. 294 OP RPT FRICTION BRAKE FAULT B. TRUCK. OP CUT OUT TRK AND WILL FILL OUT DEFECT SHEET.   CAB A
9/11/2017 12:43:00 PM,2307938,LRV237,101,8,3138,LRV237 TCU FAULTS/ PROP FAULTS. AT RESTR SPEED. KEY OUT/IN WOULD NOT CLEAR. WILL CUT AT ENGLWD INTO ELATI. WILL ADD NEW LRV TO CONSIST WHEN ABLE.   CAB A
9/11/2017 5:26:00 AM,2307736,6325,38,5,0022,LOW COOLANT LIGHT CAME ON. BUS WENT TO BACK DOOR MECHANIC TO CHECK BUS. BUS WAS CLEARED AND IS UNDERWAY. STARTED 5 MINS LATE
9/11/2017 1:07:00 AM,2307639,6031,43,15,0520,INTERIOR LIGHTS WENT OUT ON THE BUS. 43 BLK 1 WILL TRADE BUSES AT END TERMINAL AND BUS WILL RUN TRIP LATE
9/10/2017 6:50:00 PM,2307594,5245,51,15,0160,THE CURB SIDE REAR OUTSIDE TIRE IS FLAT.
9/10/2017 5:39:00 PM,2307560,LRV134,107,15,3138,TCU FAULT LRV 134ý RSTD SPD. CUT LRV SMR PCKT.   CAB A
9/10/2017 4:27:00 PM,2307558,1535,AT,168,0022,BATTERY LIGHT AND STOP ENGINE LIGHT. BUS STOPPED ON PENA. EM MAINTENANCE NOTIFIED. SS21 HERNANDEZ TRANSPORTED THE 2 PASSENGERS ON BOARD TO THE DIA. SS21 ALSO TRANSPORTED THE 3 PASS
9/10/2017 2:51:00 PM,2307493,LRV276,101,15,3100,FRICTION BRK FAULT LRV 276. REST SPD. TRADED CONSIST.   CAB B
9/10/2017 1:21:00 PM,2307488,5122,31,142,0105,BLEW FRONT AIR BAG (NO LOOP AVAILABLE TO FILL); -142 MIN
9/10/2017 1:49:00 PM,2307478,5007,11,20,1020,PAX STUCK ON WHEEL CHAIR RAMP/ HARD TO UNDERSTAND OPERATOR/ CONTACT DIV./ WILL SEND SUPV. TO ASSIST/ SEEMS THE WHEELCHAIR ROLLED OFF TRACK/ NEED MAN POWER TO LIFT/ CONTACT DFD TO A
9/10/2017 10:27:00 AM,2307430,6041,31,40,0022,CHECK ENGINE/REGEN NEED LIGHT ON BUS AT 10 MPH. PL SENDING BUS WITH MECHANIC. OP CONTINUE WITH PAX ON NB TRIP. 40 LATE
9/10/2017 11:16:00 AM,2307429,LRV210,101,15,3134,OP STATED THAT LRV 210 HAD A INVERTER FAULT AND LRV 267 HAD A BLOWER FAULT. CONSIST WAS TRADED OUT AT MARIP.   CAB A
9/9/2017 11:40:00 PM,2307289,6020,16,48,0047,HOT LUNCH IN THE BUS. //RESPACED TO COLO MILLS EB
9/9/2017 8:47:00 PM,2307262,6309,169,15,0022,CHK ENG AND DEF LIGHT ON CALLED EM TO SEND TRADE OUT
9/9/2017 2:36:00 PM,2307123,LRV305,101,2,3106,ATS PENALTIES LRV305A. AT BDWY SB. KEY OUT/IN DIDN`T CLEAR. KEPT COMING BACK. PUT IN BYPASS TO LOUIS. AGAIN AT DUS TAIL TRACK. PUT IN BYPASS INTO STATION THEN RE-ENGAGE.   CAB A
9/9/2017 1:43:00 PM,2307107,LRV315,101,13,3100,LRV315 C-TRUCK. FRCTN BRK FAULT. STOPPED TRAIN TWICE. KEY OUT/IN CLEARED EACH TIME. OOS FROM ALAM TO MARIP. FILLED SPC NB OSAGE W/SPARE CONSIST AT MARIP.   CAB A
9/9/2017 12:44:00 PM,2307087,6333,28,44,0022,LOW COOLANT LIGHT ON. NO LEAKS. BACK TO PLATTE FOR A TRADE UPON ARRIVAL TO 21ST/CHAMPA. RE-SPACED TO 38TH/YOUNGFIELD AFTER TRADE.
9/9/2017 10:50:00 AM,2307059,5156,12,49,0310,AIR LEAK 49MINS
9/8/2017 5:12:00 PM,2306736,5031,28,40,1020,LIFT WON`T STOW; OPERATOR NOT PICKING UP PAX; -40 MIN
9/8/2017 3:24:00 PM,2306648,LRV304,101,18,3114,ORIGINAL CALL FRICTION BRK AND DOOR FAULT. YELLOW LIGHT ON DOOR 4. INSTRUCTED TO CUT OUT. TRN DID NOT MOVE. S-11 CUT OUT. OKAY NOW.   CAB B
9/8/2017 2:06:00 PM,2306593,3913,401,64,0705,LOST POWER; TRADE; -64 MIN
9/8/2017 12:33:00 PM,2306541,9383,83,39,0022,STOP ENG ST RESP 118PM
9/8/2017 7:39:00 AM,2306468,9356,122X,20,0405,LOST ALL COOLANT/ BUSTED HOSE/PAX PU BY FOLLOW BUS/ PLATTE DIV. WILL SEND A TRUCK/ COOLANT NOT GOING INTO DRAINS/ BUS ON LAST TRIP/ OP WILL STAY WITH BUS/ NO LOOPS
9/8/2017 7:14:00 AM,2306413,9405,120X,28,0028,FRONT DOOR WILL OPEN AND CLOSE ON ITS OWN. TRUCK CLEARED. RE-SPACED TO DUS 0831. LOSS SB TRIP 28 MINUTES.
9/8/2017 6:35:00 AM,2306377,LRV227,101,15,3101,TRAIN-37 RECOEVED BCU FAULTS ON LRV-255 THEN BLUE LIGHT ON LRV-227 B-TRK. HAD HIM CUT OUT Aý B AND C TRUCKS TO MOVE FREELY. TRADE AT I-25 WITH LRX.50   CAB B
9/8/2017 5:56:00 AM,2306362,LRV107,107,15,3100,TRAIN-29 LRV-107ý BRAKES WOULD NOT RELEASE SOUTH BOUND. TRADE AT 13TH WITH LRX-20.   CAB A
9/8/2017 5:33:00 AM,2306348,6240,15,22,0001,UKN REASON FOR BLOOD ON THE FLOOR. RESP 558AM DVR
9/7/2017 8:24:00 PM,2306161,6068,130,55,0135,POWER STEERING WENT OUT ON BUS //CALLED EM TO SEND TRUCK AND TRADE FOR OP //PAX ACCOMODATED BY FOLLOWER/// TOO LATE TO DO ANY MORE OF ROUTE //PULL IN
9/7/2017 6:07:00 PM,2306116,5065,19,24,0160,CURBSIDE FRONT TIRE FLAT /CALLED FTM TO ADVISE //TRADE MADE //
9/7/2017 5:37:00 PM,2306115,5187,76,57,0160,FLAT TIRE; TRADE; -57 MIN
9/7/2017 12:23:00 PM,2306016,6041,44,23,0022,THE CHECK ENGINE AND REGEN LIGHT IS ON .
9/7/2017 11:11:00 AM,2306011,9388,15L,76,0305,THE MIDDLE OF THE BUS HAS AN AIR LEAK. RE-SPACED TO THE DECATUR STN TO LEAVE AT 13:48.
9/7/2017 3:33:00 PM,2305996,1807,FMR,10,0505,HAD OP START AT CCS
9/7/2017 3:02:00 PM,2305982,1994,J,15,1005,LIFT OUT OF TRACK// TRADED WILL BE LATE PULLING OUT // TO RUN LATE
9/7/2017 2:31:00 PM,2305973,5107,76,50,0405,COOLANT LEAK; TRADE; -50 MIN
9/7/2017 2:31:00 PM,2305970,1805,FMR,16,0305,HAD LOW PSE PLRR CLR TO RUN. RESP 257P
9/7/2017 12:58:00 PM,2305960,5059,10,15,0605,BUS NOT POWER - SLOW; TRADE; -15 MIN
9/7/2017 11:46:00 AM,2305951,5071,12,30,0505,NO START; TRADE; -30 MIN
9/7/2017 12:17:00 PM,2305946,6287,105,26,0022,CK ENG MIL REGEN. YELLOW. S32 TO TRANSPORT MLX OPER BACK TO EM. RESP 1256PM
9/7/2017 8:07:00 AM,2305802,9320,15L,27,0047,HOT LUNCH//RE-SPACED TO WB COLFAX/BILLINGS.
9/7/2017 7:01:00 AM,2305751,6132,100,24,0610,BUS NO POWER; NO START; -24 MIN
9/7/2017 5:10:00 AM,2305705,LRV232,101,10,3132,232 PROP FAULTS RESTRICTED SPEEDý COASTING FREELY. TRIED KEY DOWN/UP FAULT RETURNEDý WILL DEBOARD AT BELLVIEW AND PLACE IN SOUTHMOOR POCKET.   CAB A
9/6/2017 7:12:00 PM,2305524,LRV310,101,4,3128,LRV 310 WAS GETTING AN INVERTER FAULT HAD TO CUT IT OFF ON THE PEPSI SIDE TRACK   CAB A
9/6/2017 6:13:00 PM,2305499,LRV281,103,5,3100,OPERATOR REPORTED FRICTION BRAKE A-TRUCK AND BCU. KEY OUT/UP DI NOT CLEARý CUT IN TAILý WILL RETURN TO ELATI WITH PULLBACK OPERATOR.   CAB A
9/6/2017 5:00:00 PM,2305485,3635,FF,95,0022,STOP ENG LIGHT CAME ON AND STALLED THREE TIMES //CALLED 3621 NEXT FF4 TO PICK UP PAX //CALLED BOULDER TO SEND TRUCK OUT //NO MLX AVAIL TO RUN SPACE // REPAIRED AND SENT BACK TO BOU
9/6/2017 5:04:00 PM,2305477,6246,3,32,0022,CHK ENG STOP ENG LIGHTS ON STALLS OUT// CALLED MLX 81 TO TRADE //OP WONT ANSWER //TOOK 8 MINUTES/// LAST TRIP HAD RUN LATE FROM ALLISON VIRGINIA TO FED CTR
9/6/2017 2:17:00 PM,2305424,3601,FF,113,0022,NO CHARGE LIGHT/ BUS SHUT DOWN/ NO NLX/ RESPACED 23RD MAIN 426PM
9/6/2017 2:01:00 PM,2305377,5021,36L,8,0038,CURBSIDE EXT MIRROR WAS BROKE
9/6/2017 10:09:00 AM,2305285,5262,21,51,0705,OP CANT GET BUS INTO GEAR OP FROM ANOTHER BUS HELP. TRADE WITH LX2 AND RE-SPACE TO EVANS STN 1102. RUN LATE FROM THERE. LOSS== 51 MINUTES
9/6/2017 8:34:00 AM,2305256,9307,15L,68,0022,HOT ENG CK ENG; LEAKING COOLANT. DRIPPING. ST. RESP 1016AM
9/6/2017 8:18:00 AM,2305235,3913,77,8,0710,HARD DOWN SHIFTING. I HAVE NECK PAIN; FEELING LIGHT HEADED. REFUSE EMT. TD.
9/6/2017 7:44:00 AM,2305229,3925,27,19,0505,NO START; -19 MIN
9/6/2017 5:46:00 AM,2305199,3932,401,15,0110,SUSPENSION PROBLEM; LOOP P/U SPACE; -15 MIN
9/5/2017 3:42:00 PM,2304931,6214,10,95,0160,FLAT TIRE; TRADE; DROPPED 1+ TRIP; -95 MIN
9/5/2017 3:35:00 PM,2304922,3638,FF,15,0125,THE BUS IS STUCK IN THE KNEEL POSITION.
9/5/2017 4:30:00 PM,2304902,LRV283,103,1,3106,ATS INTO BY PASS TO MOVE OUT OF TAIL TRKS.   CAB A
9/5/2017 2:44:00 PM,2304866,5074,76,65,0110,FRONT AIRBAG OUT; TRADE; DROPPED 1 TRIP; -61 MIN
9/5/2017 2:36:00 PM,2304831,1805,FMR,14,0305,OP AT BACK DOOR LOW PSI. OP MISSED FIRST TRIPý CONTINUE TO DUS. 14 MINUTES LOST
9/5/2017 1:13:00 PM,2304792,LRV310,101,15,3128,TRAIN-55 REPORTED APS AND BLOWER FAULTS FROM LRV-310 NORTH BOUND OSAGE. BE-BARKED AND REVERSED INTO MARIPOSA AND TRADE SOUTH BOUND ALAMEDA.   CAB A
9/5/2017 11:20:00 AM,2304773,5167,92,24,0305,LOW AIR PRESSURE; TRADE; -24 MIN
9/5/2017 10:44:00 AM,2304754,LRV204,101,7,3138,TRAIN-32 LRV-204 TCU AND PROPULSION FAULTS. CUT AT OSAGE AND ADD CUT CAR FROM LINCOLN.   CAB A
9/5/2017 6:51:00 AM,2304685,1539,AA,55,0710,TRANSMISSION IS SHIFTING REALLY HARD EAST METRO MECHANIC NOTIFIED AND WILL SEND T-TRUCK TO ASSIST. MLX 38 TO TRADE BUS
9/5/2017 5:47:00 AM,2304668,1522,116X,1,0505,NO START; PLRR WAS NOTIFIED.
9/5/2017 6:38:00 AM,2304666,3957,JUMP,28,0110,BUS LEANS; TRADE; -28 MIN
9/5/2017 6:11:00 AM,2304664,3921,77,34,0022,LOW OIL LIGHT/// 5001 ON SPACE FROM MNRL STN 646AM
9/4/2017 3:03:00 PM,2304398,6067,133,35,0625,HUB SEAL LEAKING //CALLED EM TO SEND TRADE OUT //CURTAILED TRIP // RESPACED TO NINE MILE
9/4/2017 2:33:00 PM,2304396,3940,228,70,0610,ENGINE STALLS; DROPPED 1+ TRIP; -70 MIN
9/4/2017 10:19:00 AM,2304329,3912,46,23,0505,BUS DIED; TRADE; -23 MIN
9/3/2017 4:33:00 PM,2304134,5130,51,81,0160,TIRE BLOWNOUT; -81 MIN
9/3/2017 4:01:00 PM,2304105,2123,19,4,0610,THE ENGINE DIED AFTER THE STOP ENGINE LIGHT CAME ON.
9/3/2017 1:46:00 PM,2304015,LRV290,103,10,3103,TWC NOT WORKING TRIED FLIPPING BREAKERý TRADED CONSIST AT DUS. LRV290A   CAB A
9/3/2017 1:35:00 PM,2304013,LRV290,103,10,3103,TR. 77 LRV 290 A. OP RPT TWC WOULD NOT LIGHT UP AND UNABLE TO MAKE CALLý WILL FILL OUT DEFECT SHEET.   CAB A
9/3/2017 11:48:00 AM,2303990,3705,BOLT,19,0160,BUS HAS A FLAT TAG TIRE/ CURBSIDE/ CONTACT BOULDER/ WILL WORK ON TRADE/ WILL PAGE RUNNING REPAIR/ T-TRUCK SENT TO AREA/ NEW BUS TO RUN IT LATE
9/3/2017 8:49:00 AM,2303916,3956,JUMP,10,0305,LOW AIR PRESSURE. BUS ST. SS 253. . TRADE WITH LX AND RUN 10 LATE
9/3/2017 5:52:00 AM,2303889,6177,3,15,0022,COOLANT LEAK ON PULL OUT; -15 MIN
9/2/2017 5:58:00 PM,2303732,6274,15,18,0022,CHECK ENGINE AND MIL LIGHT ONýOPERATOR WILL HEAD TO RUNNING REPAIR.OPERATOR RESP TO COLFAX/BILLINGS WB 6:22 PM
9/2/2017 5:21:00 PM,2303708,5244,76,33,0505,NO START; TRADE; -33 MIN
9/2/2017 2:25:00 PM,2303629,LRV297,101,2,3103,NO COMMS TO TWC LOOPS. NO LIGHTS ON TWC PANEL. BREAKER RESET DID NOT WORK   CAB A
9/2/2017 11:42:00 AM,2303576,6041,16,65,0022,REGEN/CHECK ENGINE LIGHT ON. BUS ST. NO POWER. OP AT TERMINAL LX 2 TRADE THERE. PL TRUCK SENT. BUS RE-SPACED TO DECATUR STN. 1315. LOSS 65 MINUTES.
9/2/2017 11:58:00 AM,2303561,LRV283,101,4,3106,ATS IN LINC TT ALSO PASSING S1332SE. BY-PASS BOTH TIME TO MOVE.   CAB A
9/1/2017 9:55:00 PM,2303363,6224,SKIP,36,0225,PARK BRAKE HANDLE FELL OFF/ BO RUNNING REPAIR/ T205
9/1/2017 7:13:00 PM,2303328,LRV299,101,15,3130,OPERATOR REPORTED APS INVERTER FAULT. HAD OPERATOR CLEAR TRAINý CUT ACý CUT LIGHTS AND TAKE CONSIST TO SOUTHMOOR POCKET. 526 ON SCENE VERIFIED DEAD TOW. REPLACED OUT OF MARIPOSA NB
9/1/2017 6:40:00 PM,2303307,6246,16,33,0022,FIRE ALARM / RESPACED DECA STN WB 740PM
9/1/2017 6:30:00 PM,2303296,6084,15,115,0022,OPERATOR ARRIVED TO THE END TERMINAL NEARLY 60 MINUTES LATE. CHECK ENGINE LIGHT AND ABS LIGHT ON. OPERATOR DOESN`T FEEL SAFE TO CONTINUE BECAUSE IT IS TAKING LONG TO STOP. EM MAINT
9/1/2017 3:39:00 PM,2303175,LRV317,101,10,3132,B-CLASS PRULP FAULT. DEBOARD ALA. PICK UP TRIP SB ALL FRICT BRAKES CUT OUT.   CAB A
9/1/2017 3:07:00 PM,2303148,3733,AA,28,0160,FLAT TIRE/RIS DUAL/ST/MLX T/S13/3714 MADE THE STOP AND HELPED OUT/T286/REPAIRED AND SENT TO 40TH AS MLX
9/1/2017 10:26:00 AM,2303069,1536,AT,10,0022,CK ENG / EM RR TRADED
9/1/2017 11:40:00 AM,2303050,5005,51,54,0022,STOP ENGINE AND LOW OIL LIGHTS; BUS DIED; TRADE; -54 MIN
9/1/2017 12:01:00 PM,2303030,6038,1,64,0022,CHECK ENGINE LIGHT/REGEN NEEDED. INTERMIT ON. NO LEAKS OP ST. BUS OK TO CONTINUE AT 1407. TRADE LATER. LOSS 64 MINUTES.
9/1/2017 11:02:00 AM,2303023,6037,20,41,0110,23RD/ONEIDA FRONT END IS BOUNDING. S/T. RESP 1158AM
9/1/2017 11:29:00 AM,2303008,3964,324,11,0705,BUS WILL NOT GO INTO DRIVE. BUS ST. FTL SENDING LX.
9/1/2017 9:37:00 AM,2302970,6242,121,58,0022,CK ENG LIGHT AND ALARM // CK FOR LEAKS // TURN OFF TO RESET COMP// CALL BACK
9/1/2017 7:41:00 AM,2302934,6278,73,61,0022,STOP ENG; ENG DIED. S/T. RESP 842AM
9/1/2017 6:01:00 AM,2302844,6127,21,53,0022,DRIPPING COOLANT; HOT ENGINE LIGHT; SERVICE TRUCK; DROPPED 1 TRIP; -53 MIN
9/1/2017 5:19:00 AM,2302774,5014,66,10,0160,LATE STARTING BECAUSE LOW TIRE / MAINTENANCE HAD TO FILL TIRE
8/31/2017 5:16:00 PM,2302552,6288,42,97,0022,LOW COOLANT /ST/STOP ENGN ST/T317/TO EM OFF
8/31/2017 5:12:00 PM,2302540,2100,55L,80,0625,LOST POWER STEERING / PL HOOK
8/31/2017 5:11:00 PM,2302499,5067,32,69,0160,FLAT TIRE -69 MIN
8/31/2017 1:28:00 PM,2302375,6024,28,10,1005,LIFT STUCK /OPP GOT TO GO RUN LAT ALL ACCMD PAX OK
8/31/2017 11:46:00 AM,2302358,5017,27,50,0038,CURB MIRROR IS LOOSE. CAN`T SEE. S/T. TD. RESP 1236P
8/31/2017 9:59:00 AM,2302309,LRV133,103,5,3134,133 TCU BLOWER FAULTS WOULD NOT CLEAR AFTER THROWING BREAKERSý ALSO HAD DISC BRAKES APPLY ONCE THEN CLEAR.   CAB A
8/31/2017 10:03:00 AM,2302307,6134,51,74,0610,STOP ENGINE -74 MINS
8/23/2017 6:27:00 AM,2302292,5258,29,12,0625,OIL LEAK DISCOVERED AT PULL OUT. BUS TRADED OUT. ARRIVED TO THE START TERMINAL AT 6:34AM. TRANSDEV NOTIFIED. 

RE SAVE
8/31/2017 9:06:00 AM,2302287,3909,92,88,0510,LOOSE CONNECTIONS ON BATTERYý OPERATOR HAS HAD TO CHECK IT 3 TIMESý KEEPS LOSING POWERý TO FT FOR AN MECHANIC TO MEET IN ROUTE/ RESPACE TO THORTON PNR 1213P
8/31/2017 6:00:00 AM,2302152,LRV136,103,10,3138,LRV 136ý TCU FAULT WITH ACTIVE BRAKE DRAG PER OPERATORý UNKNOWN TRUCK/BRAKE AT THIS TIME. CONSISTS PULLED FROM SERVICE. REPLACED WITH LRX 50ý MARIPOSA.   CAB A
8/31/2017 5:54:00 AM,2302131,1542,CV,3,0022,CHECK ENGINE
8/31/2017 5:30:00 AM,2302085,9360,72L,3,0305,OPERATOR HAD A PROBLEM GETTING THE AIRPRESSURE TO BUILDý OKAY NOW AND PULLING OUT LATEý NO SERVICE LOSS
8/30/2017 4:12:00 PM,2301855,5262,42,52,0610,BUS RUNNING ROUGHýOPERATOR RESP TO ORLINS/MAXW 5:09 TO START THE ROUTE 45 WB ON TIME.
8/30/2017 4:16:00 PM,2301827,9353,0L,29,0022,STOP ENGINE LIGHT/ START 457PM TRIP LINC 16TH
8/30/2017 3:51:00 PM,2301802,1510,FF,5,1025,BOLT MISSING FROM SEAT BELT IN W-CHAIR AREA.
8/30/2017 2:51:00 PM,2301782,3946,128,31,0625,OIL LEAK/ SIDETRACKED/ CALLED FT/ RESPACED TO WAGON RF 349PMý WILL RUN LATE
8/30/2017 12:38:00 PM,2301774,9402,15L,66,0160,RR OS DUAL FLAT /PL/TIRE REPLACED RESP DECATUR
8/30/2017 2:33:00 PM,2301759,LRV217,101,6,3101,OPERATOR ADVISED ON A BCU B CLASS INDICATING ON B TRUCKý VERIFIED ROLLING FREELYý VERIFIED LIGHT ON LRV 217. KEY OUT/UP DID NOT CLEAR CAME BACK AS BCU B&C TRUCKý IN ADDITION TCU FA
8/30/2017 2:20:00 PM,2301734,LRV266,101,2,3114,TRAIN-65 CUT OUT DOOR #2 ON LRV-266 DUE TO DOOR NOT CLOSING.   CAB A
8/30/2017 2:01:00 PM,2301721,5070,38,85,0022,BUS LOST POWER. BUS ST. PAX ACCOMMODATED BY FOLLOWER. FT? OP TAKE NEW BUS TO RELIEF OP RESPACED TO YOUNGSIELDý 1544 LOSS 85 MINUTES.
8/29/2017 11:03:00 PM,2301347,6117,43,50,0022,THE DEF LIGHT IS ON. BACK TO THE GARAGE FOR A TRADE. RE-SPACED TO CENTRAL PARK PNR AFTER TRADE.
8/29/2017 7:51:00 PM,2301324,6234,DASH,21,0610,THE ENGINE SHUT DOWN AFTER THE STOP ENGINE LIGHT CAME ON. RE-SPACED TO TBMS PNR TO LEAVE AT 20:20.
8/29/2017 6:55:00 PM,2301310,5015,31,57,0135,STEER LOOSE -57 MINS
8/29/2017 3:42:00 PM,2301298,6137,59,25,0160,FLAT TIRE. TD KNOWS ABOUT IT ALREADY.
8/29/2017 4:40:00 PM,2301253,5017,51,20,0022,WARNING LIGHT -20 MINS
8/29/2017 6:55:00 AM,2300954,1806,FMR,62,0305,30PSI. OPER SAID HE CALLED PLRR 27MIN AGO NO RESPONSE YET; PLRR SAID OPER CALLED @ 645AM TU7 SHOULD BE WORKING ON THE BUS NOW. SIGNOUT OPER CALLED AT 718AM OPER SAID NOBODY HAS HEL
8/28/2017 9:59:00 PM,2300727,3636,FF,15,0160,THE CURB SIDE INSIDE TREAD CAME OFF. MLX BLOCK 11 ON SPACE FROM DUS AT 22:43.
8/28/2017 8:07:00 PM,2300708,6331,32,31,0022,LOW TRANSMISSION FLUID LIGHT CAME ON.
8/28/2017 6:11:00 PM,2300656,6245,16,58,0022,BOTHý THE CHECK AND STOP ENGINE LIGHT IS ON. RE-SPACED TO LINCOLN/16TH.
8/28/2017 4:07:00 PM,2300591,3901,323,22,0610,STOP ENGINE LIGHT. THE ENGINE KEEPS DYING OUT. FTL ADVISED.
8/28/2017 5:21:00 PM,2300577,1407,133,13,0605,THE CHECK ENGINE LIGHT IS ONý AND THERE IS LOSS OF POWER. T288.
8/28/2017 2:20:00 PM,2300554,3931,46,86,0160,TIRE VALVE LEAKING; SERVICE TRUCK; -86 MIN
8/28/2017 4:23:00 PM,2300530,5172,55L,17,0705,BUS DROPPED OUT OF GEAR. OP RESET MASTER. NO LX TO FILL. DROPPED FIRST TRIP. PAX ACCOMMODATED BY FOLLOWER.  LOSS 35 MINUTES OP DID DO 2ND TRIP
8/28/2017 1:56:00 PM,2300474,6041,16,57,0022,CHECK ENGINE LIGHT ON REGEN NEEDED. BUS ST PAX ACCOMMODATED BY FOLLOWER. TRADE WITH LX 7 AT TERMINAL BUS RESPACED TO RELIEF TIME. LOST 57 MINUTES.
8/28/2017 1:38:00 PM,2300429,6253,15,71,0022,FIRE ALARM // CALLED T TRUCK 316 TO CK OUT //TOLD OP TO CK FOR SMOKE//WILL TRADE
8/28/2017 11:50:00 AM,2300349,1679,MALL,12,0022,ALARM ISSUE /PARKING BRAKE //CALLED SS18 TO LET KNOW
8/28/2017 10:16:00 AM,2300336,6071,15,14,0022,LOW DIESEL FLUID/T316 DUS /GOT T GO RUN LATE
8/28/2017 9:29:00 AM,2300292,5085,10,55,0022,STOP ENGINE LIGHT ON BUS DIED. BUS ST. NO LEAKS. PAX ACCOMMODATED BY FOLLOWER. FT SENDING TRUCK. TRADE WITH LX RE-SPACED TO CCA AT 1058A.    LOSS 55 MINUTES.
8/28/2017 9:16:00 AM,2300276,3965,324,14,0022,STOP ENGINE LIGHT ST; CALLED FTL TRADE
8/28/2017 5:57:00 AM,2300205,9335,15L,55,0022,CHECK ENGINE LIGHTý  LOW COOLANT LIGHTS ARE ON AND BUS HAS SHUT DOWN EAST METRO MAINTENANCE NOTIFIED.  BUS SENT TO EAST METRO FOR A TRADE  BUS RE-SPACED TO TERMINAL ON OHIO AT 7:50
8/28/2017 3:21:00 AM,2300058,6280,169,9,0022,ST/STOP ENGINE; LOW COOLANT; TRUCK FIXED
8/27/2017 6:22:00 PM,2300022,9378,15L,21,0645,FUEL LEAKING FROM THE BACK OF THE BUS.
8/27/2017 5:56:00 PM,2299985,5212,225,37,0505,NO START
8/27/2017 6:41:00 AM,2299776,6073,15,64,0705,TRANSMISSION NOT GOING INTO GEAR.  SENT BACK TO GARAGE FOR TRADE
8/26/2017 2:00:00 PM,2299507,1401,42,1,0610,TRANNY LIGHT CAME ON AND THE ENG DIED/WILL NOT RESTART/ST/LX T/T317/1518 BUS STARTED AND T317 WILL FOLLOW TO PLATTE
8/26/2017 1:49:00 PM,2299483,6134,11,34,0022,CHECK ENGINE LIGHT; TRADE; -34 MIN
8/26/2017 12:10:00 PM,2299429,6204,40,1,0022,STOP ENG LIGHT ON/WILL TRY TO GET IT TO THE SM PR/IT KEEPS DIEING/FT/T/REESP 60 DAHLIA
8/26/2017 7:52:00 AM,2299404,5125,66,40,0022,BUS WONT MOVE; WARNING LIGHTS; LOOP; -40 MIN
8/26/2017 8:45:00 AM,2299398,6245,16,43,0022,LOW COOLANTý STOP ENGINE LIGHT PL MA NOTIFIED MLX 7 TO TRADE BUS.  BUS WAS RE-SPACED TO COLFAX AND LINCOLN TO START 9:40 TRIP
8/25/2017 8:15:00 PM,2299216,LRV251,101,30,3100,FRICTION BRAKE Bý B CUT OUTý ALL BRAKES CUT OUTý ALL BRAKE CABLES PULLED.PULLED INTO ELATI   CAB A
8/25/2017 5:07:00 PM,2299199,9384,15L,99,0160,CURBSIDE OUTER DUAL ON TRAILER FLAT/2ND BUS THIS AFTERNOON/S25 CHECK FOR RD HAZARD/S25 REPORTS SIGNIFICANT DAMAGE TO WHEEL AND BODY/OP DOES NOT KNOW WHERE OR WHEN IT HAPPENED/SEPAR
8/25/2017 4:12:00 PM,2299173,9383,15L,130,0022,SEE PREV INC/ALARMS BACK/ST AT COLF EB-GRANT/NO LOOPS AVAILABLE/PAX ACCOM BY FOLLOWER/LIMP TO PL/RESPACE TO COLF BDWY 1822
8/25/2017 2:52:00 PM,2299156,3922,77,127,0505,NO START; TOW; DROPPED 6 TRIPS; -186 MIN
8/25/2017 3:14:00 PM,2299139,9371,15L,15,0160,FLAT TIRE TRAILER CURBSIDE OUTER DUAL
8/25/2017 4:13:00 PM,2299114,LRV211,101,15,3114,TRAIN DOORS DID NOT OPEN WE HAD TO UNCOUPLE AND THEY WORKED CUT IT OFF AND RAN WITH A 3 CAR   CAB A
8/25/2017 3:46:00 PM,2299097,6272,42,57,0405,RED FLUID ALL OVER THE GROUND/ST/LX T/T317/HAD HIM DH TO ORLN AND MAXW FOR HIS WB TRIP AFTER TRADE/REPAIRED AND WILL OVERHEAT WITH AC ON?SENT TO GARAGE VIA MLX OPERATOR
8/25/2017 2:59:00 PM,2299094,3946,112,29,0625,OIL LEAK/ CALLED FT/ RESPACED 106TH MEL 400PM
8/25/2017 1:25:00 PM,2299085,9378,15L,70,0160,CURBSIDE OUTER DUAL TIRE FLAT // CALLED PLATTE TTRUCK //MECH DROVE BACK TO PLATTE //OP TO WAIT FOR NEW TIRE //NO BUS AVAIL// RESPACED TO COLFAX AND BILLINGS WB AT 315 ///CANCELLED
8/25/2017 2:25:00 PM,2299083,LRV142,101,10,3138,TCU FAULTS W/ BRAKE LOCK UP. BRAKES RELESE WITH PRULP. FAULTS NOW TCU / BCU. TRADE W/ MARIP LRX.   CAB B
8/25/2017 2:46:00 PM,2299072,6303,15,7,0022,LOW COOLANT; EMRR WORKING ON THE BUS.
8/25/2017 2:47:00 PM,2299066,3629,FF,44,0630,OP HAD BAD BELT/ENGINE SHUT ITSELF DOWN/ST/T205-1549/OP HAD ONE PAX AND THIS WOULD BE LIKE THE OLD RTE "DM"/MLX COVERED THE 344P TRIP FROM FITZ/1554 BUS REPAIRED/HAD HIM TAKE HIS O
8/25/2017 7:42:00 AM,2298938,5148,20,33,0022,CK ENG;BZR; NO POWER CC. S/T AURARIA/5TH
8/25/2017 6:58:00 AM,2298849,9311,15L,21,0030,REAR DOOR; NOT OPENING/CLOSING CORRECTLY. RNSP LATE.
8/25/2017 7:01:00 AM,2298841,LRV203,101,10,3114,LRV203 DOOR 4ý WAS PUT BACK IN SERV BY MNTC AT ELATI BUT RECV`D DOOR FAULT AT YALE. DOOR NOT CLOSING. USED CLOSE OUT KNOB NEXT TO DOOR TO CLOSE. WILL RUN W/ DOOR 4 OOS.   CAB B
8/25/2017 5:24:00 AM,2298795,1807,FMR,29,0505,NO START IN GARAGE OP CALL BACK AND CONTINUE LATE. FIRST TRIP LOST. 29 MINUTES.
8/24/2017 10:03:00 PM,2298639,6081,65,45,0022,CK ENGINE/HIGH EXHAUST TEMP/EM FIX/RUN LATE
8/24/2017 10:00:00 PM,2298613,LRV203,103,3,3114,DOOR 4 WOULDN?T CLOSEý CLOSED OUT DOOR   CAB B
8/24/2017 9:50:00 PM,2298612,LRV103,101,10,3138,TCU STOP KEY DOWN AND UP TWICE DIDN?T WORK HAD OPERATOR  USE THE HAND DEAD MAN THAT WORKED.   CAB A
8/24/2017 4:35:00 PM,2298565,9310,15L,63,0160,SCREW  IS IN THE REAR INNER DUALý CURBSIDE/ NO MLX/ RESPACED COLF COLO EB 559PM
8/24/2017 4:34:00 PM,2298521,6162,88,91,0012,THE SEAT BELT WONT  COME OUT. CC IS AWARE OF IT. RE-SPACED TO THORNTON PNR TO LEAVE AT 17:18.
8/24/2017 4:31:00 PM,2298515,LRV248,101,7,3100,C TRUCK CUT OUT. PULLED IN TO MARIP. LRX FILLED SPACE.   CAB A
