DATETIME_OCCURRED,INC_ID,VEHICLE_ID,ROUTE,DELAY_MINUTES,SYMP_SYMPTOM,DESCRIPTION
5/30/2017 11:24:00 PM,2255734,3950,92,16,0610,ST@1138A/ BUS KEEPS DYING/ 5 TIMES PER OPERATOR/ CHECK ENG AND NO CHARGE INDICATOR LIGHTS/ 5176 WILL PICK SPACE AT THORTON PNR @1144A/ SWITCH SEATS AT US36/ SHERIDAN
5/31/2017 6:58:00 AM,2255716,LRV203,101,5,3138,203 WHITE LIGHT RESTRICTING TRAIN COASTING FREELY MADE IT INTO SOUTHMOOR POCKET.   CAB A
5/31/2017 5:01:00 AM,2255632,9363,83,4,0525,OPERATOR WAS TRADED OUT BEFORE PULLOUT DUE TO A MECHANINCAL ISSUE INVOLVING THE TALE LIGHTS. PULLED OUT LATE AND ARRIVED TO THE START TERMINAL 4 MINUTES LATE. SEE DVIR.
5/31/2017 5:00:00 AM,2255630,6090,169,25,0022,STOP ENG; ENG DIED. LOW COOLANT S/T. RESP 520AM LATE.
5/31/2017 3:43:00 AM,2255508,LRV317,101,5,3100,317 FRICTION BRAKE RESTRICTED SPEED. CUT OUT B-BRAKE.   CAB A
5/30/2017 3:12:00 PM,2255451,1529,AT,15,1005,PULLED OUT LATE DUE TO A MALFUNCTIONING LIFT. THE OPERATOR FAILED TO CONTACT DISPATCH ABOUT IT UNTIL AFTER PULL OUT TIME.
5/30/2017 7:40:00 PM,2255441,LRV124,101,1,3114,DOOR-12 LOCKED OUT. DOES NOT LOCK.   CAB A
5/30/2017 6:14:00 PM,2255415,3901,BOND,11,0505,STALLED NO START /FTL /TRADE
5/30/2017 4:48:00 PM,2255407,1512,AB,17,0022,ST/CK ENG/STOP ENG/COOLANT LKý LX AT 1705-SPACE LATE
5/30/2017 1:47:00 PM,2255400,2123,20,35,0022,STOP ENG LITE CAME ON / BUS STOPPED RUNNING  / LIGHT WENT OFF / OP CONT RTE / OP WILL WRITE UP IN DOT BOOK / T-316 / OP WILL RUN RTE LATE EB FROM NREL  /
5/30/2017 3:34:00 PM,2255377,LRV261,103,1,3132,C-CLASS PRULP FAULTS. SO FAR TRAIN- OKAY.   CAB A
5/30/2017 11:55:00 AM,2255300,LRV115,107,5,3103,TWC NOT LIGHTING UPý LRV115B. BURYING CAB AT PEORIA   CAB B
5/30/2017 8:05:00 AM,2255192,6019,3,33,0225,ST/PARKING BRAKE PIN FELL OUTý IN LAYOVER AREA/ FOUND THE PIN BUT THE OPERATOR CANNOT PUT IT BACK IN TO EM/ (T288 SENT AT 830A) RUN TRIP LATEý THEN DROP OFF ONLY FROM THE ALAM STAT
5/30/2017 5:30:00 AM,2255189,6060,16,45,0022,STOP ENG;MIL; LOW COOLANT. LIGHT. DRIPPING COOLANT. MLX 2 6104 RNSP 649-749. RESP 807
5/30/2017 5:44:00 AM,2255134,6011,48,15,0022,CK ENG;  MIL ;FLASHING RE GEN..
5/30/2017 5:27:00 AM,2255114,1531,CV,29,0525,MASTER SWITCH PROBLEMý WOULD NOT GO INTO NIGHT RUN/ TRADE AND CANNOT GET THE DOOR OPEN ON THE TRADE/ PULLED OUT 37 MINUTES LATE/ STARTED TRIP AT 626A
5/30/2017 4:11:00 AM,2255109,6148,51,39,1020,LIFT DRIFT. ADV. NO ADA. ST. RESP 532AM
5/30/2017 1:08:00 AM,2254985,LRV240,101,5,3132,INTERMITTENT C-CLASS FAULTS. OP REPORTS FAULT COMES ON GENERALLY IN BUMPY AREAS. LRX-80 TO TAKE BACK TO ELATI.   CAB A
5/29/2017 2:44:00 PM,2254904,3901,BOND,14,0405,COOLANT LOW STOP ENGN/ST/FTL
5/29/2017 1:27:00 PM,2254865,6236,SKIP,48,0022,CHK ENG LIGHT MIL LIGHT DEF LIGHT ON //TOLD TO RESET BY TURNING ALL THE WAY TO OFF POSITION AND BACK TO LIGHTS AFTER 2 MINUTES//NO LEAKS OR MISSING BELTS/
5/29/2017 12:33:00 PM,2254838,9324,15L,47,0022,CK ENG LIGHT AND OVERHEATING //STALLED// CALLED EM TO GET TRADE AND TRK//CURTAILED TRIP TO DECATUR //WILL RUN EB TRIP AT 131PM
5/29/2017 7:29:00 AM,2254746,1512,AB,15,1005,PULLED OUT 727//WC LIFT WOULDN?T OP ON 1512
5/28/2017 7:27:00 PM,2254608,1502,N,44,0605,BUS WONT GO OVER 15 MPH //IN NEDERLAND // CALLED BOULDER MAINT//SENDING TRK AND TRADE// OP OUT OF DOT WILL HAVE TO PULL IN WHEN GET DOWN OFF MOUNTAIN//
5/28/2017 12:59:00 PM,2254516,1996,FF,10,0910,NO AC// TRADE
5/28/2017 1:27:00 PM,2254510,5002,51,21,0405,COOLANT LEAK. BUS ST. APX ACCOMMODATED BY FOLLOWER. LX 31 SENT TO TRADE. RUN LATE WITH PAX AFTER TRADE. 21 LATE.
5/28/2017 5:28:00 AM,2254430,LRV143,107,5,3138,143 TCU FAULTSý TRIED KEY DOWN/UP AND FAULT RETURNED.   CAB A
5/28/2017 4:31:00 AM,2254422,6058,16,8,0505,NO START/T
5/27/2017 8:55:00 PM,2254323,LRV203,103,3,3138,LRV 203 HAS A TCU FAULT WILL NOT CLEAR ROLLING FREELY AT RESTRICTED SPEED.   CAB A
5/27/2017 2:52:00 PM,2254224,5043,6,55,0028,OTHER OP TOOK DOOR HANDLE //RELIEF COULDN?T CONTINUE// GOT NEW DOOR HANDLE FROM FTM SS //CANCELLED TRIP AT 210 P ///
5/27/2017 8:44:00 AM,2254113,3920,59,97,0105,BUS KNEELS. BODY RUBBING ON TIRE. BUS ST.  TDý BUS TRADED WITH INST BUS. LOSS FROM DAKOTA RIDGE HS 0906--DAKOTA RIDGE HS 1105 LOSS 97 MINUTES.
5/27/2017 4:55:00 AM,2254076,6008,16,97,0022,LOW COOLANT LIGHT ON. BUS DIED. BUS ST. PL SENDING TRUCK. NO LX TO TRADE/RUNSP. TRUCK FOLLOW BACK TO GARAGEý LOSS 0508--0656 97 MINUTES. PAX ACCOMMODATED BY FOLLOWER.
5/27/2017 5:35:00 AM,2254070,5036,88,15,0160,REAR STREETSIDE OUTSIDE TIRE FLAT. BUS ST. CC SENDING LX TO TRADE. LX TRADE AND OP CONTINUE WITH PAX 15 LATE.
5/27/2017 5:24:00 AM,2254039,LRV228,101,6,3100,FRICTION BRAKE FAULTý LRV228C-TRUCK. CUT OUT VIA ROTARY. TRADING CONSIST AT BROADWAY.   CAB A
5/26/2017 7:17:00 PM,2253897,5052,28,42,0022,THE ENGINE STALLED OUT.CC ADVISED.
5/26/2017 4:48:00 PM,2253824,3950,92,73,0610,STALLED OUT AND WOULDN?T RESTART///CALLED FTM //CALLED BACK GOT BUS STARTED AND MOVING AGAIN//CALLED FTM TO LET KNOW//WILL TRADE SOON/// PICK UP SPACE AT GAYLORD AND EPPINGER AT 60
5/26/2017 4:05:00 PM,2253809,6225,SKIP,70,0225,PARKING BREAK BROKEN OFF. TRUCK TO LOCATION. TRADE AT LOCATION. RESPACE AT LOCATION ON TIME.
5/26/2017 3:34:00 PM,2253800,3807-R-2000,324,14,1020,LIFT WONT MOVE PAX ON THE LIFT CALLED FTLMA3807//BUS 3801 RUNNING SPACE WILL MEET AT PARKRIDGE AND MAIN WALMART // BACK ON ROUTE
5/26/2017 3:29:00 PM,2253793,3919,27,10,0022,LOW COOLANT/STOP ENGINE LIGHT ON.. COOLANT LEAK. BUS ST. PAX ACCOMMODATED AFTER TRADEý CONTINUE ON ROUTE 10 LATE. .
5/26/2017 3:21:00 PM,2253756,LRV138,101,10,3114,TRAIN-1 DOOR ISSUES AT 27TH LRV-139 DOOR#2 AND LIGHT WOULD NOT GO OUT. DOOR IS CUT OUT AT SD-11 SWITCH.   CAB B
5/26/2017 1:32:00 PM,2253713,1402,48,76,0720,BUS WILL NOT SHIFT/GO OVER 25 MPH. NO LX TO TRADE OP BRING BUS TO GARAGE TO TRADE. LOSS FROM 1253--1430. 76 MINUTES.
5/26/2017 12:21:00 PM,2253706,6011,0,81,0022,REGEN NEEDED WITH CHECK ENGINE LIGHT. BUS ST. TRADE AT BROADWAY STN TRADE WITH LX 10 LOSS 1210--1402 81 MINUTES.  
   
   
   
   
   
   
   
  :1
5/26/2017 6:26:00 AM,2253516,9373,15L,101,0405,ST/ OPERATOR STATED HE HAS SMOKE COMING FROM THE DASHý ALL PAX EXITED THE BUS/ MECHANIC REQUESTED THAT EVERYTHING BE SHUTDOWN/ COOLANT LEAKý TO PLATTE FOR TRADE @722A/ RESPACE TO C
5/26/2017 5:30:00 AM,2253485,LRV268,101,13,3100,FRICTION BRAKE COMING INTO UNIVERSITY RESTRICTED SPEED KEYED DOWN/UP CUT OUT C TRUCK OUT  CUT CAR AT SOUTHMOOR   CAB A
5/26/2017 5:30:00 AM,2253445,1503,AB,1,0160,OUTSIDE CURBSIDE DUALý CUT IN THE SIDEWALL PER S34/ARRIVAL 737A
5/26/2017 5:25:00 AM,2253439,3964,324,23,0610,ST/ BUS HAS DIED 3 TIMESý STOP ENGINEý LOW OILý BUS WILL NOT CONTINUE TO RUNý TO FTL/ RUN TRIP LATE WITH TRADE
5/26/2017 4:40:00 AM,2253381,5136,38,43,0022,CHECK ENGINE LIGHTý ABS LIGHT. PLATTE MAINTENANCE ADVISED. PER T317 THIS BUS HAS TO GO BACK TO THE GARAGE. NO LOOP`S AVAILABLE. RE-SPACED TO YOUNG FIELD AND 38TH. FOLLOWER ACCOMMOD
5/25/2017 10:39:00 PM,2253288,3635,FF,15,0047,MLX11 TRADE
5/25/2017 8:51:00 PM,2253252,6174,52,20,1350,NO INTERIOR LIGHTS/CC TRADE
5/25/2017 6:40:00 PM,2253212,6020,21,5,0160,FLAT CURB SIDE REAR OUTSIDE TIRE.
5/25/2017 3:17:00 PM,2253171,5160,40,100,0160,CURBSIDE INNER DUAL BLOWN/FT/RESPACE TO SOUTHMOOR
5/25/2017 3:53:00 PM,2253158,2296-R-2000,130,35,0022,HOT TRANSMISSION ALARM/MLX15 TRADE/RESPACE TO AUR MET 1636
5/25/2017 2:43:00 PM,2253132,LRV216,101,15,3100,EXACT SAME FAULT ON SAME LRV AS REPORTED YESTERDAY. OPERATOR REPORTED FRICTION BRAKE B CLASS CENTER TRUCKý KEY OUT/UP CLEARS AND ALLOWS ROLLING FREELY TEMPORARILY BUT FAULT RETURNS
5/25/2017 12:53:00 PM,2253099,1505,BOLT,30,0028,FRONT DOOR BROKEN / S-20 / OP WILL GO TO DIV FOR NEW BUS / OP RESP  FRCC 1:42P / OP WILL RUN RTE LATE
5/25/2017 10:53:00 AM,2253062,6030,16,11,1005,POPS UP/OPP TO CHECK FOR DEBRI/STILL ISSUE/TRD MLX 10
5/25/2017 6:38:00 AM,2252970,9328,120X,29,0038,PANEL OPENED ON DRIVER SIDE OF BUS. OPERATOR NOT FAMILIAR ON HOW TO USE DOOR AS KEY LOCK. OPERATOR FEELS UNSAFE TO DRIVE. SIDETRACK AT LOCATION. TRUCK TO MEET. INSTRUCTION BUS SHOW
5/25/2017 7:04:00 AM,2252963,9314,15L,6,0305,OPER SAID PSI WAS NOT BUILDING; BUT NOW ITS OK. PULLED OUT LATE.
5/25/2017 6:41:00 AM,2252953,5021,51,10,0160,ROS DUAL FLAT/T
5/25/2017 6:00:00 AM,2252943,LRV207,101,6,3131,LPS INVERTER FAULT AND BLOWER FAULT DEBOARDED AT ENGLEWOOD REPLACED AT EVANS WITH LRX 10   CAB A
5/25/2017 4:22:00 AM,2252760,6031,16,6,0520,DOME LIGHTS NOT WORKING. PLRR CLR TO RUN.
5/24/2017 4:51:00 PM,2252672,5013,51,55,0610,THE CHECK AND STOP ENGINE LIGHT IS ON. TD ADVISED. RE-SPACED TO 44TH/EATON
5/24/2017 6:49:00 PM,2252664,9314,15L,20,0022,BUS STOPPED RUNNING / LOW COOLANT LITE IS ON / T-288 / OP WILL WRITE UP IN DOT BOOK
5/24/2017 4:59:00 PM,2252627,1502,L,43,0028,FRONT DOOR STUCK OPEN/ST PAX OFF BUS NLX99 TRD OR RUN LATE
5/24/2017 4:37:00 PM,2252625,6100,42,26,0160,LEFT FRONT TIRE LOW/ST/MLX 7 TRADE /EM TRK
5/24/2017 3:27:00 PM,2252596,2081-R-2000,15,65,0715,BLOWN HYDRAULIC HOSE TO GEAR BOX/NEEDS TOW/MLX78 TRADE/RESPACE TO COLFAX DOWNING WB 1640
5/24/2017 4:11:00 PM,2252579,LRV216,101,13,3100,OPERATOR REPORTED FRICTION BRAKE B CLASS CENTER TRUCKý KEY OUT/UP CLEARS AND ALLOWS ROLLING FREELY TEMPORARILY BUT FAULT RETURNS AND BRINGS TRAIN TO A STOP AND DRAGS. ADVISED OPERA
5/24/2017 4:17:00 PM,2252572,LRV143,101,10,3138,TRAIN-4 30TH TCU FAULTS IN LRV-126 CENTER OF CONSIST. NOW AT RESTRICTED SOUTH BOUND OSAGE AND WILL TRADE AT ENGLEWOOD WITH LRX 30.   CAB A
5/24/2017 3:37:00 PM,2252550,LRV148,101,2,3114,TRAIN-5 CUT OUT DOOR #1 ON LRV-148 NB I-25. DOOR WOULD NOT CLOSE WITHOUT RECYCLING MULTIPLE TIMES.   CAB A
5/24/2017 3:03:00 PM,2252544,LRV298,101,6,3128,TRAIN-11 SB 18TH/STOUT RECEIVED APS MAJOR FAULT ON LRV-298 A-CAB. DEBARKED PAX AT 18TH AND PULLED IN FROM OSAGE. D-LINE BEHIND HIM 6 MINUTES TO PICK UP PAX AND PICK TRIP UP AT ENGL
5/24/2017 2:19:00 PM,2252508,9317,15L,104,0028,OP UNABLE TO CLOSE FRONT DOOR/TRIED LIFT/NO GO/EM SENDING MECH OUT TO BUS/IT IS WB ACROSS STREET FROM EM DIV///AT 1452 U SPOTTED 9317 IN EM GARAGE/HE HAD TRADED TO 9316/RESP EB AT
5/24/2017 1:07:00 PM,2252491,9353,83,25,0022,CK ENG LIGHT PLRR. RESP 135PM
5/24/2017 12:25:00 PM,2252474,6033,1,65,0160,TIREý STREET SIDE REAR OUTSIDE DUAL/ FLAP PIECES HIT TIRE? S14 TO CHECK AT ALLI VIRG/ NEEDS TIRE TRUCK/ T306 PULLED THE EXCESS OFF THE TIREý STATED SAFE TO CONTINUE IN ROUTE/ RESPA
5/24/2017 8:35:00 AM,2252379,LRV207,101,5,3134,207 BLOWER FAULTS WOULD NOT CLEARý TOOK FOR MAINLINE FROM ENGLEWOOD STN.   CAB A
5/24/2017 4:40:00 AM,2252228,5128,21,7,0510,NO CHARGE LIGHT. TD. OPER IS GOING BACK TO TD FOR A TRD. RNSP LATE.
5/23/2017 6:05:00 PM,2252048,5002,59,123,0405,STOP /ST /COOLANT LEAK /BUS WAS ST FROM 605P-808P FOR 2:03
5/23/2017 6:51:00 PM,2252046,LRV101,107,5,3106,ATS ALARM DIDN?T AFFECT MOVEMENT PUT ATS IN BYPASS ABLE TO MOVE   CAB A
5/23/2017 3:12:00 PM,2252014,6218,DASH,115,0022,LOW COOLANT LIGHT ON. BOULDER MAINTENANCE ADVISED. T-205 RESPONDING. TIC ADVISED. PER MAINTENANCE THE BUS HAS A BAD SENSOR AND WENT INTO DERATE. BUS SENT BACK TO THE GARAGE. AFTER
5/23/2017 1:03:00 PM,2251878,LRV215,101,5,3100,FRICTION BRAKE FAULTY LRV215Bý CENTER CARý CUT OUT AND DEBOARDED PAX AT BROADWAY. TRADE WITH LRX50   CAB B
5/23/2017 10:13:00 AM,2251816,1626-R-2001,MALL,32,0505,RESPACE TO 17TH / WEWATTA @1053A
5/23/2017 6:16:00 AM,2251791,9356,120X,27,0305,LOW AIR PRESSURE. BUS WONT START. NO WARNING LIGHTS OR OTHER PROBLEMS. PLATTE MAINTENANCE NOTIFIED. DUS EAST STARTER RUBIO NOTIFIED. SS32 MACIAS GOT THE BUS MOVING WITH A REAR ENGI
5/23/2017 7:06:00 AM,2251765,5059,19,58,0160,INSIDE TIRE IS BLOWN ON THE STREET SIDE. FT METRO NOTIFIED. BUS 5190 TO TRADE. RE-SPACED TO 13TH AND WELTON AT 8:04AM.
5/23/2017 7:24:00 AM,2251746,5166,40,10,0505,ST/ NO START/ TRADE AT LOCATION @724A
5/23/2017 7:03:00 AM,2251737,1511,FF,6,1020,LIFT SEAT BELT STUCKý NOT MOVING AT THE BACKDOOR/ GOOD BUSý DELAYED PULLOUT/ RUN TRIP LATE
5/23/2017 6:10:00 AM,2251715,2097,0,1,0530,S30; MIC WAS NOT WORKING.
5/23/2017 6:04:00 AM,2251708,3950,228,10,1030,OPERATOR STATED HE HAD A RAMP PROBLEM WITH 3950/ ARRIVED LATEý STARTED AT APIA
5/22/2017 3:53:00 PM,2251426,LRV226,.101,1,3100,TRAIN-66 CUT OFF HIS ADD AT LINCOLN; LRV-226 FRICTION FAULT ON B-TRUCK OF CAR. CUT BACK OFF IN TAIL.   CAB B
5/22/2017 2:27:00 PM,2251409,LRV147,101,5,3114,TRAIN-6 DOOR #1 ON LRV-147 CUT OUT TO GET DOOR LIGHT TO GO OUT.   CAB A
5/22/2017 3:23:00 PM,2251408,1529,AT,37,0022,CK ENG AND STOP ENG/ST/LTH//T317//BUS DUE TO RUN THE "AT" TO ARAP STN////MISSED THE TRIP/MLX CO VERED THE RX PART OF RUN
5/22/2017 2:41:00 PM,2251393,1535,P,12,1005,RUNNING REPAIR HAD TO TAKE A LOOK AT HIS LIFT. OPERATOR PULLED OUT LATE. SS59 WING NOTIFIED.
5/22/2017 12:02:00 PM,2251306,2150,139,8,1315,DELAYED PULLOUT BUS NEEDED FIRE EXTINGUISHER //CALLED EM MAINT TO GET MOVING /
5/22/2017 10:50:00 AM,2251298,6037,16,15,0022,LOW TRANS FLUID LIGHT ON //WILL HAVE T TRUCK MEET AT 1137 LINCOLN AND 16TH
5/22/2017 10:40:00 AM,2251275,5261,45,73,0605,BUS WONT GO BEYOND 25 MPH. NO WARNING LIGHTS. OPERATOR WILL SHUT THE BUS DOWN FOR 5 MINUTES AND SEEING IF THAT CLEARS THE PROBLEM. SHUTTING DOWN THE BUS RESOLVED THE PROBLEM. BUS I
5/22/2017 7:29:00 AM,2251268,6185,50,12,0160,REAR CURBSIDE OUTSIDE TIRE FLAT. BUS ST. PAX ACCOMMODATED BY FOLLOWER. CC TRADE WITH PULL IN BUS. OP RE-SPACED TO OLD TOWN 0803 .. 12 LOST.
5/22/2017 8:58:00 AM,2251266,9366,15L,136,0630,STOP ENGINE LIGHT. BUS DIED. ST BROKEN BELT. TRUCK SENT. PAX ACCOMMODATED BY FOLLOWER. OP RE-SPACED TO AURORA STN 1141 TRIP LOST 0858 TO 1141++ 136 MINUTES.
5/22/2017 7:38:00 AM,2251225,6047,12,44,0022,CHECK ENGINE LOW COOLANT LIGHT ON. OP RESET MASTER AND CONTINUE. BUS DIED. NO ON CALL TRUCK. PL RR SENDING TRUCK PAX ACCOMMODATED BY FOLLOWER. LOW COOLANT SENSOR BYPASSED BY TRUCK.
5/22/2017 6:08:00 AM,2251207,1536,RX,3,1005,PER SS38 MAGUIREý THIS OPERATOR PULLED OUT AT 6:04AM DUE TO A LIFT PROBLEM CHECKED AT RUNNING REPAIR. ARRIVED TO START TERMINAL AT 6:35AM. SS38 NOTIFIED.
5/22/2017 6:19:00 AM,2251191,6201,14,5,0022,SEE RALPH`S CALL. STOP ENGINEý CHECK ENGINEý AUDIBLE ALARM. AT LAKEWOOD COMMONS. BUS 5016 WILL TRADE OUT THE BUS.
5/22/2017 5:34:00 AM,2251156,6083,131,4,0022,EMRR; CK HAD TO TRD.
5/22/2017 5:13:00 AM,2251149,6002,16L,19,0022,CHECK AND STOP ENGINE LIGHTý OPERATOR PULLED OUT LATE.
5/22/2017 4:02:00 AM,2251144,6111,15,34,0022,ST BUS STALLED AND WON`T RESTARTýCHECK ENGINE AND LOW COOLANT LIGHT.OPERATOR RESP TO COLFAX/LAWRENCE EB 4:56 AM
5/22/2017 1:36:00 AM,2251063,LRV281,103,3,3103,THE TWC IS NOT WORKING TRIED THE BREAKER DID NOT FIX IT   CAB B
5/21/2017 6:44:00 PM,2251017,3722,AB,120,0160,TREAD CAME OFF STREET SIDE TAG TIRE/EM MEET/BOLT PAX ACCOM BY FOLLOWER/RESPACE TO NEXT AB 30 MINUTES LATE
5/21/2017 7:16:00 PM,2251013,6047,14,10,0022,LOW COOLANT RED/YELLOW MIL/SHUTTING DOWN FOR 3 MINUTES RESET/RUNNING OK NOW BUT TRADE ANYWAY
5/21/2017 11:03:00 AM,2250884,1542,AA,9,0405,LEAKING COOLANT. OPER GOING TO PLRR.
5/21/2017 7:47:00 AM,2250775,9366,15L,93,0022,STOP ENGINE LIGHT ON. LOW COOLANT LIGHT ON. EM RUNNING REPAIR NOTIFIED. BUS TRADED OUT AT EAST METRO. RE-SPACED TO COLFAX AND DOWNING EB AT 9:20AM.
5/21/2017 2:56:00 AM,2250645,3712,AB,10,0028,PASSENGER DOOR WONT CLOSE. UNABLE TO GET AHOLD OF RUNNING REPAIR. MAINTENANCE PAGED AND CALLED WITH NO RESPONSE. BOULDER DIVISION SUPERVISOR CALLED TO ASSIST. TRADED OUT WITH1504.
5/20/2017 10:06:00 PM,2250620,5022,73,33,0610,BUS STALLED WONT START//MOVE //CALLED TD//CURTAILED LAST TRIP///FINISHED/// LOST TIME 33
5/20/2017 7:02:00 PM,2250577,6023,32,145,0022,CK ENG AND STOP ENG AND ALARM WENT OFF //TURNED BUS OFF AND SAID SENT MESSAGE OUT OF SERVICE /WE DIDN?T GET ONE //SAT FOR TWO HOURS AND DIDN?T CALL ANYONE //GOT CALL ON SCREEN SHOW
5/20/2017 2:09:00 PM,2250508,2077-R-2000,15,56,0001,FOUND DIRTY UNDERWARE IN THE BACK OF THE BUS. SECURITY TO GET IT. DVR. RESP 310PM //TRADE MADE 316K///
5/20/2017 2:10:00 PM,2250489,LRV107,107,2,3106,MULTIPLE ATS TRIPS AT 385 SWITCHES (9MILE TAIL) AND AT NORTH HB PEORIAý TRADING CONSIST.   CAB A
5/20/2017 12:05:00 PM,2250465,6082,83,20,0022,STOP ENG; LOW COOLANT. S/T. BZR. T288. FOLLOWER PASSED BY; DROP OFF ONLY.
5/20/2017 6:55:00 AM,2250386,6023,32,10,0022,STOP ENGN/NO LEAKS OR SMOKE BELTS OK/T316/MLX 7 /OPP GOT TO GO OK CNX
5/20/2017 7:27:00 AM,2250377,6282,83,38,0022,CHECK ENGINE LIGHT AND THE STOP ENGINE LIGHT HAVE BOTH COME ON.  MLX 80 TO DO BUS TRADE BUS RE-SPACED TO LINCOLN AND BROADWAY AT 8:33AM
5/20/2017 4:54:00 AM,2250367,5121,31,55,0705,BUS WILL NOT GO INTO GEAR. BUS ST. TD PAX ACCOMMODATED BY FOLLOWER. LX STARTED NB TRIP FEDERAL-EVANS. 0552. FIRST TRIP LOST. 55 MINUTES LOST.
5/19/2017 11:52:00 PM,2250194,6175,11,38,0505,ST NO STARTýOPERATOR WILL RUN LAST TRIP LATE
5/19/2017 9:35:00 PM,2250177,LRV114,107,30,3138,MULTIPLE TCU FAULTS.TRAIN DRAGGING A TRUCK. HAD TRAIN DEBOARD AT 13TH.   CAB A
5/19/2017 5:18:00 PM,2250150,3904,JUMP,10,0505,NO START//FTL ADVISED. 3958 ON SPACE
5/19/2017 3:34:00 PM,2250118,5018,19,108,0030,BLUE LIQUID GUSHING OUT NEAR THE BACK DOOR. THE GUSHING HAS STOPPED. OPERATOR STATED HE LEFT A PUDDLE AT13TH  AND WELTON. PULLED OVER AT WEWATTA AND 17TH. OPERATOR RE-SPACED TO 13T
5/19/2017 2:52:00 PM,2250115,5074,6,140,0160,CURBSIDE DUAL ON THE OUTSIDE IS FLAT. WENT FLAT GRADUALLY. FT METRO NOTIFIED AND WILL TRADE THE BUS OUT AT ABILENE AND CEDAR. BUS 5079 TRADED OUT THE BUS AT. RE-SPACED TO QUEBEC AN
5/19/2017 4:08:00 PM,2250106,2075,0,62,0022,CK ENGINE AND STOP ENGINE AND ALARM //STALLED WONT START//CALLED PLATTE FOR TRADE AND TRUCK //NO MLX AVAIL// CURTAILLED TRIP  TO DUS//GOT BUS STARTED AGAIN// BACK IN ROUTE CALLED T
5/19/2017 2:44:00 PM,2250018,1507,BOLT,73,0022,CHECK ENG/ POWER LOSS/ WILL CHECK AT TERMINAL AT THE BO STAT/DID NOT CALL WITH ANY MORE INFO/LOADED PASSENGERS ANDS TRIED TO LEAVE BUT HAD NO ACCELERATION/S20NEWBY ON SCENE/PAX ACC
5/19/2017 12:58:00 PM,2250014,6258,45,129,0022,THE CHECK ENGINE AND REGEN LIGHT IS ON. T288. RE-SPACED TO 40TH/ARPT.
5/19/2017 1:19:00 PM,2249981,LRV215,101,15,3100,TRAIN-55  LRV-215 AýB AND C CUT OUT AT ROTARY DUE FRICTION BRAKE FAULTS. TRADE AT OSAGE AND IN AT MARIPOSA.   CAB A
5/19/2017 11:18:00 AM,2249954,5124,51,4,0022,RED SOOT FILTER LIGHT ON CALLED TD TO ADVISE //TRADE DONE
5/19/2017 10:46:00 AM,2249940,6293,121,40,0160,STREET SIDE OUTER DUAL TIRE FLAT  ////CALLED EM TO GET TRUCK AND TRADE SENT OUT AND  CURTAILLED TRIP //RESPACED TO PEORIA STN 1141
5/19/2017 10:39:00 AM,2249917,6158,72,34,0610,STALLED OUT WONT START
5/19/2017 7:04:00 AM,2249835,5201,Y,33,0160,STREETSIDE OUTSIDE TIRE FLAT. BUS ST. TRADE WITH LX 31 PAX ACCOMMODATED LATE AFTER TRADE.
5/19/2017 5:27:00 AM,2249772,3973,401,31,0022,LOW OILý CHECK/STOP ENGINE LIGHT ON. BUS DIED WILL NOT RESTART/ BUS ST. PAX ACCOMMODATED BY FOLLOWER/. LX 31 WILL START AT 0615 AND TRADE BROKEN BUS WHEN FIND. LOSS 31 MINUTES 0525
5/19/2017 4:30:00 AM,2249691,LRV103,101,7,3138,TCU FAULT. KEY OUT/UP. DID NOT CLEAR. CUT SINGLE CAR ON A-TRK MINERAL. NEW CAR ADDED EVANS N/B.   CAB A
5/18/2017 10:15:00 PM,2249606,2296-R-2000,42,46,0002,THE WIRING TO THE DRIVER FAN IS SPARKING CAUSING THE INSIDE OF THE BUS TO SMOKE. T288. MLX BLOCK 11 ON SPACE FROM 40TH/ARPT PNR.
5/18/2017 4:17:00 PM,2249561,2100,32,164,0135,ITS GETTING REAL HARD TO STEER THE BUS. NO MLX AVAILABLE. RE-SPACED TO 38TH/YOUNGFIELD.
5/18/2017 3:29:00 PM,2249519,1996,J,52,0910,DEFROSTER NOT WORKING ///CALLED BOULDER MAINT/TO SEND OUT TRADE //RUNNING LATE FROM 23RD AND MAIN
5/18/2017 4:07:00 PM,2249496,2162,42,57,0610,STALLED WONT START//CANCELLED FIRST TRIP//CALLED EM MAINT/// WILL TAKE OUT TRADE AND SEND TRK//288//LOST TRIP 411-508//NO MLX//TRADE DONE TOLD OP TO GO TO END TERMINAL AT MAXWELL A
5/18/2017 4:43:00 PM,2249491,LRV257,101,2,3106,OPERATOR RECEIVED AN ATS PENALTY FOR NO REASON. HAD TO KEY OUT   CAB A
5/18/2017 4:36:00 PM,2249490,NOID,101,7,3114,TRAIN-4 DELAYED 7 MINUTES DUE TO OPERATOR NOT ABLE TO FIGURE OUT THAT HE HAD A DOOR LIGHT ON AND HAD TO CUT OUT TO MOVE. LRV-124 DOOR #12 LIGHT NOT GOING OUT.
5/18/2017 1:28:00 PM,2249464,5236,31,93,0920,NO DS DEFROST/OPP ST AT FRCC 211PM/PICKED UP RT AT 408PM 32 FED NB
5/18/2017 3:19:00 PM,2249440,5121,36L,56,0610,BUS SHUT DOWN AT LOCATION. POWERLOSS. TD NOTIFIED. 5020 RUNNING SPACE FROM FEDERAL EVANS AT 1619
5/18/2017 2:23:00 PM,2249403,LRV147,101,2,3114,TRAIN-7 CUT OUT DOOR #1 ON LRV-147 DUE TO DOOR OPENING AND CLOSING ON IT`S OWN.   CAB A
5/18/2017 12:24:00 PM,2249354,6070,15,2,0044,WILL SEND SOMEONE OUT TO REPAIR BIKE RACK
5/18/2017 11:12:00 AM,2249321,3710,N,330,0165,ST/ ANOTHER PERSON THAT WAS IN A CAR CALLED FROM BOULDER / CELLPHONE RANGE STATING THIS BUS IS ST/ AND THREW HIS CHAINSý THEY ARE STUCK BETWEEN THE L-REAR DUALS/ TO BO RR/ RECEIVED
5/18/2017 6:34:00 AM,2249179,5169,52,105,0915,NO HEAT TO FT/ OPERATOR COULD NOT CONTINUE AT 58TH AND KIPLING @736A/ RESPACE WITH TRADE TO LARIMER AND 20TH @905A
5/18/2017 4:23:00 AM,2249055,1403,0,10,0610,ST STOP ENGINE LIGHT BUS DIEDýOPERATOR RESP TO EVANS NB 4:58 AM
5/18/2017 12:55:00 AM,2248976,6148,51,45,0705,BUS WON`T GO INTO GEAR/RAMP LIGHT ONý OPERATOR CLEARED THE PROBLEM AND CONTINUED LAST TRIP LATE.
5/17/2017 8:46:00 PM,2248956,2075,12,20,0610,SEE PREV INC/BUS DIED AGAIN AT 104TH GRANT/ST/LAST TRIP/ONE PAX ACCOM BY FOLLOWER/S40 CHESTNUT BEHIND BUS W LIGHTS ON/MECH FOLLOWING BUS BACK
5/17/2017 4:33:00 PM,2248876,6147,30,23,0022,CK ENG DEF LIGHT ON AND ALARM TOLD OP NOT TO TURN OFF ENGINE// CALLED TD //TRUCK TO MEET //CLEAR AT 1739///GOOD BUS
5/17/2017 3:54:00 PM,2248847,1406,73,45,0022,AC QUIT/FANS QUIT/NO CHARGE/ST/MLX TRADE/RESPACE TO CTRL PK
5/17/2017 10:38:00 AM,2248724,5090,89,11,0610,STOP ENGN/ST CC TRADE
5/17/2017 9:29:00 AM,2248673,3949,92,37,0047,HOT LUNCH. ST. FT. RNSP LATE.
5/17/2017 6:16:00 AM,2248609,1529,P,53,0610,ENGINE SMOKING. PINK FLUID DRIPPING. CHECK ENGINE LIGHT. SIDETRACK AT LOCATION.
5/17/2017 7:08:00 AM,2248595,5130,4,28,0160,ST/ FLAT OUTSIDE DUAL ON THE RIGHT SIDE TO TD/ 6154 TDLX 20 TO PICK UP SPACE AT ALAM STAT @742A. TRADE AT 804A
5/17/2017 6:15:00 AM,2248579,9363,0L,25,0022,STOP ENG. BZR. S/T S59.BAD SENSOR. RESP 650AM
5/17/2017 6:24:00 AM,2248571,9374,15L,8,0022,CHECK ENGINE LIGHT/ TRADE
5/17/2017 4:01:00 AM,2248410,1403,3,19,0610,STOP AND CHECK ENGINE LIGHTýBUS STALLEDýOPERATOR WAS ABLE TO RESTART THE BUS AND GET IT TO THE FEDERAL CENTERýOPERATOR WILL RUN TRIP LATE.
5/16/2017 5:49:00 PM,2248323,3944,128,22,0160,FLAT CURB SIDE REAR OUTSIDE TIRE. FT ADVISED.
5/16/2017 4:38:00 PM,2248289,9347,0L,21,0040,DRIVER SIDE WS WIPER INOP//CALLED T 317 TO MEET //WIPER MOTOR BAD //TRADE SENT /// CANCELLED TRIP AT 527 WILL PICK UP SPACE AT 609 LAST TRIP
5/16/2017 3:06:00 PM,2248233,5212,209,7,0125,MIGHT OF GRABBED THE WRONG BUSý CAN`T LOG ON TO ROUTE AND BLOCKý AND THE BUS WONT KNEEL BACK UP. THE BUS IS STOPPED AT SUNSET AND KEN PRATT. FT LONGMONT NOTIFIED. TRADING HIM OUT W
5/16/2017 11:59:00 AM,2248207,3925,46,21,0038,MIRROR PAX SIDE FELL OFF/TD TO MEET ON RT TRADE /ST MONACO
5/16/2017 9:38:00 AM,2248104,5008,100,39,1315,THE FIRE ALARM IS RINGINGýNO SMOKE OR FIREýOPERATOR ST THE BUS AT PARFET/6TH.THE LX IN BUS 6134 WILL RUN THE TRIP NB FROM SW PLAZA// OTHER BUS 5008 WAS REPAIRED AND WILL RESUME ROU
5/16/2017 6:10:00 AM,2248004,1529,P,3,0046,PER S24/ LIFT DOOR MALFUNCTION CAUSED PULLOUT DELAY BY 8 MINUTES/ 646A AT THE PINERY
5/16/2017 5:41:00 AM,2248003,1533,RX,3,1005,LIFT STRAP FELL APART. NO ADA.
5/15/2017 8:23:00 PM,2247810,2084,0,69,0135,LOST POWER STEERINGý  CHECK ENGINEý LIGHT STOP LIGHT IS ON. MLX 11 RUNNING SPACE FROM DUS AT 9:53PM. FOLLOWER ACCOMMODATED PASSENGERS. BUS TOWED TO PLATTE GARAGE.
5/15/2017 9:06:00 PM,2247783,6010,48,42,0022,WARNING LIGHT LOW (FLUID HYD) PLATTE MAINTENANCE NOTIFIED. T-287 RESPONDING AND WILL BE TOPPING OFF THE FLUID. REPORT OPERATOR 22207 TAKING BUS 6057 TO OPERATOR. OPERATOR IS RUNNIN
5/15/2017 6:25:00 PM,2247730,5170,40,78,0610,LOW VOLTAGE LIGHT BUS ST WONT GO IN GEAR/ FT NEW BUS 5077/ RESPACED COLO STN 739PM
5/15/2017 6:08:00 PM,2247725,5027,100,37,0022,CHECK ENGINE LIGHTý STOP ENGINE. OPERATOR STATED THAT THE RADIATOR CAP IS OFF. 5124 HEADING TO TRADED THE BUS OUT. OPERATOR WILL RUN THE TRIP LATE DUE TO LONG HEADWAYS ON THE ROUTE
5/15/2017 4:20:00 PM,2247717,2294-R-2000,105,107,0610,STOP ENGN/ST/T288/NEED TOW/BACK TO EM/OPP TO GET BUS RUN COLFAX TO HAVANNA SB LAST TRIP
5/15/2017 3:41:00 PM,2247674,3736,CV,4,1005,SS41 EXCELL CALLED TO SAY PULLING OUT 8 MINUTES LATE BECAUSE OF A LIFT ISSUE AT THE GARAGE. ARRIVED TO HIS TERMINAL AT 3:54PM PER STATION STARTER WING.
5/15/2017 4:36:00 PM,2247673,5092,100L,57,0160,CURBSIDE INSIDE FLAT.. BUS ST. NO LX TO FILL. DROPPED 100L LOSS 57 MINUTES. PAX ACCOMMODATED BY FOLLOWER.
5/15/2017 4:02:00 PM,2247661,9345,72L,10,0022,CK ENGINE AT PULL OUT/BACK DOOR TRADE/P O 18 LATE/
5/15/2017 3:28:00 PM,2247643,LRV215,103,6,3100,OPERATOR ADVISED FRICTION BRAKEý DRAGGINGý KEY OUT/UP DID NOT CLEARý CUT CENTER TRUCK. SWAPPED AT DUS OUT OF MARIPOSA WITH LRX 50.   CAB A
5/15/2017 3:56:00 PM,2247640,6009,34,109,1335,LOW FUEL LIGHT ON. BUS STALLED BUT RESTARTED. PL  RR WANTS TO TRADE. RTD MLX 78 BUS 2133 RAN SPACE 615PM-647PM/ T317 GOT BUS UP AND RUNNING RESPACED TO CENTRAL PARK AT 655PM
5/15/2017 3:24:00 PM,2247621,3738,CV,6,1005,NO RESPONSE FROM THE OPERATOR. SS41 EXCELL DOING A PULL OUT CHECK STATED THAT THE DRIVER IS AT RUNNING REPAIR FOR HIS LIFT. PULLING OUT 11 MINUTES LATE. STATION STARTER WING NOTIFI
5/15/2017 1:27:00 PM,2247592,2156,44,48,1020,WILL NOT STOW/ST/T316/TO PL TRADE
5/15/2017 2:33:00 PM,2247582,1607-R-2000,MALL,18,0515,DRIVE FAULT LIGHT IS ON.  BUS WAS FIXED AND HIS HEADED TO UNION STATION TO RE-SPACE HIMSELF
5/15/2017 1:06:00 PM,2247565,6101,15,45,0022,STOP ENGINEý LOW COOLANTý MIL LIGHTS ALL CAME ON AND BUS DIED  MLX 5 TO TRADE BUS AND EAST METRO MECHANIC WILL; ASSIST. BUS WAS RE-SPACED TO ONEIDA AND COLFAX AT 2:22
